SG_UF_PROVA;CO_MUNICIPIO_PROVA;NO_MUNICIPIO_PROVA;CO_COORDENACAO;CO_LOCAL;NO_LOCAL_PROVA
PE;2600054;ABREU E LIMA;10744;F00324;CENTRO DE OBSERVAÇÃO CRIMINALÓGICO E TRIAGEM PROFESSOR EVERARDO LUNA
PE;2601102;ARARIPINA;10772;F01123;CADEIA PÚBLICA DE ARARIPINA
PE;2601201;ARCOVERDE;10725;F00561;CASE  ARCOVERDE
PE;2601201;ARCOVERDE;10724;F01648;PRESÍDIO ADVOGADO BRITO ALVES
PE;2602100;BOM CONSELHO;10732;F07409;CADEIA PÚBLICA DE BOM CONSELHO
PE;2602803;BUIQUE;10727;F01375;COLÔNIA PENAL FEMININA DE BUÍQUE
PE;2602902;CABO DE SANTO AGOSTINHO;10765;F00006;CASE CABO
PE;2602902;CABO DE SANTO AGOSTINHO;10766;F03364;CASE PIRAPAMA
PE;2603702;CANHOTINHO;10736;F01865;CENTRO DE RESSOCIALIZAÇÃO DO AGRESTE
PE;2604106;CARUARU;10730;F01649;PENITENCIÁRIA JUIZ PLÁCIDO DE SOUZA
PE;2604106;CARUARU;10728;F01853;CASE CARUARU
PE;2604106;CARUARU;10729;F01596;CASEM CARUARU
PE;2606002;GARANHUNS;10734;F00270;CASEM GARANHUNS
PE;2606002;GARANHUNS;10733;F00584;CADEIA PÚBLICA DE GARANHUNS
PE;2606002;GARANHUNS;10735;F00269;CASE/CEMIP GARANHUNS
PE;2606200;GOIANA;10745;F07410;CADEIA PÚBLICA DE GOIANA
PE;2606804;IGARASSU;10760;F00018;PRESÍDIO DE IGARASSU
PE;2607604;ILHA DE ITAMARACA;10768;F01376;PENITENCIÁRIA PROFESSOR BARRETO CAMPELO
PE;2607604;ILHA DE ITAMARACA;10767;F00068;PENITENCIÁRIA  AGROINDUSTRIAL SÃO JOÃO
PE;2607802;ITAQUITINGA;10746;F03181;PRESIDIO  DE  ITAQUITINGA
PE;2607901;JABOATAO DOS GUARARAPES;10747;F01854;CASE JABOATO DOS GUARARAPES
PE;2608800;LAJEDO;10737;F00579;CADEIA PÚBLICA DE LAJEDO
PE;2608909;LIMOEIRO;10763;F01124;PENITENCIÁRIA DR EDVALDO GOMES
PE;2608909;LIMOEIRO;10762;F00826;PENITENCIÁRIA DR ÊNIO PESSOA GUERRA
PE;2610004;PALMARES;10761;F04469;PRESÍDIO DR RORINILDO DA ROCHA LEÃO
PE;2610905;PESQUEIRA;10726;F01125;PRESÍDIO DESEMBARGADOR AUGUSTO DUQUE
PE;2611101;PETROLINA;10739;F00008;CASEM PETROLINA
PE;2611101;PETROLINA;10740;F00007;CASE PETROLINA
PE;2611101;PETROLINA;10738;F02586;CADEIA PUBLICA FEMININA DE PETROLINA
PE;2611606;RECIFE;10751;F01102;CASEM  AREIAS
PE;2611606;RECIFE;10750;F00563;CASEM SANTA LUZIA
PE;2611606;RECIFE;10754;F01870;PRESÍDIO JUIZ  ANTONIO LUIZ LINS DE BARROS  PJALLB
PE;2611606;RECIFE;10756;F00564;CASEM ROSARINHO ANTIGA CASEM I
PE;2611606;RECIFE;10749;F03382;CASEM IPUTINGA ANTIGA CASEM OLINDA
PE;2611606;RECIFE;10755;F01866;PRESÍDIO FREI DAMIÃO DE BOZZANO
PE;2611606;RECIFE;10753;F00015;PRESIDIO ASP MARCELO FRANCISCO DE ARAUJO
PE;2611606;RECIFE;10752;F01852;CASE SANTA LUZIA
PE;2611606;RECIFE;10748;F00323;COLONIA PENAL FEMININA DO RECIFE
PE;2611606;RECIFE;10757;F00562;CASEM HARMONIA ANTIGA CASEM 2
PE;2612208;SALGUEIRO;10773;F00624;PRESÍDIO DE SALGUEIRO
PE;2612307;SALOA;10769;F01418;CADEIA PÚBLICA DE SALOÁ
PE;2612505;SANTA CRUZ DO CAPIBARIBE;10731;F02462;PRESIDIO DE SANTA CRUZ DO CAPIBARIBE
PE;2613909;SERRA TALHADA;10774;F00017;CADEIA PÚBLICA DE SERRA TALHADA
PE;2614709;TACAIMBO;10771;F02481;PENITENCIÁRIA DE TACAIMBÓ
PE;2615300;TIMBAUBA;10764;F00009;CASE TIMBABA
PE;2616100;VERDEJANTE;10770;F00070;CADEIA PÚBLICA DE VERDEJANTE
PE;2607901;VITORIA DE SANTO ANTAO;10758;F00565;CASE VITORIA DE SANTO ANTO
PE;2616407;VITORIA DE SANTO ANTAO;10759;F01611;PRESÍDIO DE VITÓRIA DE SANTO ANTÃO
PE;2616407;VITORIA DE SANTO ANTAO;10758;F00565;CASE VITORIA DE SANTO ANTO
PI;2200400;ALTOS;10781;F03441;CADEIA PÚBLICA ANTONIO JOSÉ DE SOUSA FILHO
PI;2200400;ALTOS;10780;F01460;HOSPITAL PENITENCIÁRIO VALTER ALENCAR
PI;2200400;ALTOS;10779;F00927;PENITENCIÁRIA CAPITÃO CARLOS JOSÉ GOMES DE ASSIS
PI;2200400;ALTOS;10778;F00113;COLÔNIA AGRÍCULA PENAL MAJOR CÉSAR OLIVEIRA
PI;2201903;BOM JESUS;10775;F00926;PENITENCIÁRIA REGIONAL DOM ABEL ALONSO NUNEZ
PI;2202208;CAMPO MAIOR;10782;F03084;PENITENCIÁRIA REGIONAL JOSÉ DE ARIMATÉIA BARBOSA LEITE
PI;2203701;ESPERANTINA;10783;F01462;PENITENCIÁRIA REGIONAL LUIZ GONZAGA REBELO
PI;2203909;FLORIANO;10784;F01211;PENITENCIÁRIA GONÇALO DE CASTRO LIMA VEREDA GRANDE
PI;2207009;OEIRAS;10776;F01210;PENITENCIÁRIA REGIONAL DE OEIRAS
PI;2207702;PARNAIBA;10785;F01696;PENITENCIÁRIA MISTA JUIZ FONTES IBIAPINA
PI;2208007;PICOS;10786;F00656;PENITENCIÁRIA FEMININA ADALBERTO DE MOURA SANTOS
PI;2208007;PICOS;10787;F01950;PENITENCIÁRIA REGIONAL JOSÉ DE DEUS BARROS
PI;2210607;SAO RAIMUNDO NONATO;10777;F01461;CASA DE DETENÇÃO PROVISÓRIA DOM INOCÊNCIO SANTAMARIA
PI;2211001;TERESINA;10789;F00925;CASA DE CUSTÓDIA JOSÉ RIBAMAR LEITE
PI;2211001;TERESINA;10788;F01598;CENTRO EDUCACIONAL MASCULINO  CEM
PI;2211001;TERESINA;10791;F01951;PENITENCIÁRIA REGIONAL IRMÃO GUIDO
PI;2211001;TERESINA;10790;F01697;PENITENCIÁRIA FEMININA DE TERESINA
PI;2211001;TERESINA;10792;F02327;CASA  DE  ALBERGADO DEPUTADO THEMISTOCLES FILHO
PR;4101101;ANDIRA;10795;F06746;CADEIA PUBLICA DE ANDIRA
PR;4101408;APUCARANA;10847;F06783;CADEIA PUBLICA DE APUCARANA
PR;4101507;ARAPONGAS;10848;F06803;CADEIA PUBLICA DE ARAPONGAS
PR;4101606;ARAPOTI;10842;F03164;CADEIA PUBLICA DE ARAPOTI
PR;4101804;ARAUCARIA;10820;F01688;CASA DE CUSTODIA DE CURITIBA
PR;4102109;ASTORGA;10793;F03374;CADEIA PUBLICA DE ASTORGA
PR;4102406;BANDEIRANTES;10796;F06747;CADEIA PUBLICA DE BANDEIRANTES
PR;4102604;BARRACAO;10819;F02943;ASSOCIAÇÃO DE PROTEÇÃO E ASSISTÊNCIA AOS CONDENADOS APAC BARRACAO
PR;4103701;CAMBE;10858;F06748;CADEIA PUBLICA DE CAMBE
PR;4104303;CAMPO MOURAO;10850;F06864;COMPLEXO SOCIAL DE CAMPO MOURÃO
PR;4104303;CAMPO MOURAO;10851;F03581;CADEIA PÚBLICA DE CAMPO MOURAO II
PR;4104303;CAMPO MOURAO;10849;F06941;CADEIA PUBLICA DE CAMPO MOURÃO I
PR;4104709;CARLOPOLIS;10821;F06741;CADEIA PUBLICA DE CARLOPOLIS
PR;4104808;CASCAVEL;10801;F06781;PENITENCIÁRIA ESTADUAL THIAGO BORGES DE CARVALHO PETBC
PR;4104808;CASCAVEL;10800;F01506;CENSE CASCAVEL II
PR;4104808;CASCAVEL;10799;F03285;PATRONATO PENITENCIÁRIO DE CASCAVEL
PR;4104808;CASCAVEL;10802;F06801;PENITENCIÁRIA INDUSTRIAL MARCELO PINHEIRO UP PIMPUP
PR;4104907;CASTRO;10883;F02553;CADEIA PÚBLICA DE CASTRO
PR;4105003;CATANDUVAS;10810;F01092;PENITENCIÁRIA FEDERAL EM CATANDUVASPR
PR;4106407;CORNELIO PROCOPIO;10853;F06784;CADEIA PUBLICA DE CAMBARA
PR;4106407;CORNELIO PROCOPIO;10852;F06742;CADEIA PUBLICA DE CORNELIO PROCOPIO
PR;4106605;CRUZEIRO DO OESTE;10876;F00374;PENITENCIÁRIA ESTADUAL DE CRUZEIRO DO OESTE
PR;4106605;CRUZEIRO DO OESTE;10877;F04359;COMPLEXO SOCIAL DE CRUZEIRO DO OESTE
PR;4106902;CURITIBA;10822;F00106;PATRONATO PENITENCIÁRIO DO PARANA
PR;4119509;CURITIBA;10822;F00106;PATRONATO PENITENCIÁRIO DO PARANA
PR;4106902;CURITIBA;10823;F02001;CENSE JOANA MIGUEL RICHA
PR;4107504;ENGENHEIRO BELTRAO;10824;F06723;CADEIA PUBLICA DE ENGENHEIRO BELTRÃO
PR;4107603;FAXINAL;10825;F06744;CADEIA PUBLICA DE FAXINAL
PR;4107652;FAZENDA RIO GRANDE;10826;F00447;CENSE FAZENDA RIO GRANDE
PR;4108304;FOZ DO IGUACU;10811;F00448;CENSE FOZ DO IGUAÇU
PR;4108304;FOZ DO IGUACU;10814;F03521;PENITENCIÁRIA FEMININA DE FOZ DO IGUAÇU  UNIDADE DE PROGRESSÃO  PFF UP
PR;4108304;FOZ DO IGUACU;10815;F01952;CADEIA PÚBLICA LAUDEMIR NEVES
PR;4108304;FOZ DO IGUACU;10812;F01687;PENITENCIÁRIA ESTADUAL DE FOZ DO IGUAÇU II
PR;4108304;FOZ DO IGUACU;10813;F01947;PENITENCIARIA ESTADUAL DE FOZ DO IGUACU
PR;4108403;FRANCISCO BELTRAO;10816;F01203;PENITENCIÁRIA ESTADUAL DE FRANCISCO BELTRÃO
PR;4108601;GOIOERE;10794;F04982;CADEIA PUBLICA DE GOIOERE
PR;4109401;GUARAPUAVA;10882;F03520;PENITENCIÁRIA ESTADUAL DE GUARAPUAVA UNIDADE DE PROGRESSO PEG UP
PR;4109401;GUARAPUAVA;10879;F03561;COMPLEXO SOCIAL DE GUARAPUAVA
PR;4109401;GUARAPUAVA;10881;F00107;PENITENCIÁRIA INDUSTRIAL DE GUARAPUAVA
PR;4109401;GUARAPUAVA;10880;F01701;CADEIA PÚBLICA DE GUARAPUAVA
PR;4109708;IBAITI;10845;F04781;CADEIA PUBLICA DE IBAITI
PR;4109807;IBIPORA;10859;F06861;CADEIA PUBLICA DE IBIPOR
PR;4111506;IVAIPORA;10854;F03290;APAC IVAIPORA
PR;4111803;JACAREZINHO;10855;F04696;CADEIA PUBLICA DE JACAREZINHO
PR;4112009;JAGUARIAIVA;10844;F03289;CADEIA PÚBLICA DE SENGENS
PR;4112009;JAGUARIAIVA;10843;F03163;CADEIA PÚBLICA DE JAGUARIAIVA
PR;4113205;LAPA;10827;F03516;CENTRO DE REGIME SEMIABERTO DA LAPA  CRSL
PR;4113304;LARANJEIRAS DO SUL;10804;F00994;CENSE LARANJEIRAS DO SUL
PR;4113304;LARANJEIRAS DO SUL;10803;F06862;CADEIA PÚBLICA DE LARANJEIRAS DO SUL
PR;4113700;LONDRINA;10867;F03287;CADEIA PÚBLICA FEMININA DE LONDRINA
PR;4113700;LONDRINA;10866;F04130;COMPLEXO SOCIAL DE LONDRINA
PR;4113700;LONDRINA;10861;F00103;PENITENCIÁRIA ESTADUAL DE LONDRINA II
PR;4113700;LONDRINA;10862;F01453;CASA DE CUSTÓDIA DE LONDRINA
PR;4113700;LONDRINA;10863;F01997;CENSE LONDRINA II
PR;4113700;LONDRINA;10865;F00105;PENITENCIÁRIA ESTADUAL DE LONDRINA
PR;4113700;LONDRINA;10860;F01700;CENTRO DE REINTREGRAÇÃO SOCIAL DE LONDRINA
PR;4113700;LONDRINA;10864;F06724;PENITENCIÁRIA ESTADUAL DE LONDRINA III
PR;4114203;MANDAGUARI;10798;F06943;CADEIA PÚBLICA DE MANDAGUARI
PR;4115200;MARINGA;10872;F00366;CASA DE CUSTÓDIA DE MARINGÁ
PR;4115200;MARINGA;10874;F02194;CADEIA PUBLICA DE MARINGÁ
PR;4115200;MARINGA;10870;F04137;COMPLEXO SOCIAL DE MARINGÁ
PR;4115200;MARINGA;10869;F01212;COLONIA PENAL INDUSTRIAL DE MARINGA
PR;4115200;MARINGA;10873;F01505;CENSE MARINGA
PR;4115200;MARINGA;10871;F01201;PENITENCIÁRIA ESTADUAL DE MARINGÁ
PR;4117305;ORTIGUEIRA;10841;F04487;CADEIA PUBLICA DE ORTIGUEIRA
PR;4118402;PARANAVAI;10875;F00709;CENSE PARANAVAI
PR;4118501;PATO BRANCO;10818;F03286;APAC  PATO BRANCO ASSOCIAÇÃO DE PROTEÇÃO E ASSISTÊNCIA AOS CONDENADOS DE PATO BRANCO
PR;4118501;PATO BRANCO;10817;F00707;CENSE PATO BRANCO
PR;4119152;PINHAIS;10828;F00919;COMPLEXO MEDICO PENAL DO PARANA
PR;4119509;PIRAQUARA;10833;F03462;COLONIA PENAL AGROINDUSTRIAL DO PARANÁ SEDE
PR;4119509;PIRAQUARA;10830;F01202;PENITENCIÁRIA CENTRAL DO ESTADO DO PARANÁ
PR;4119509;PIRAQUARA;10834;F03463;COLONIA PENAL AGROINDUSTRIAL DO PARANÁ SEDE
PR;4119509;PIRAQUARA;10831;F01463;CASA DE CUSTÓDIA DE PIRAQUARA
PR;4119509;PIRAQUARA;10836;F00706;CENSE SÃO FRANCISCO
PR;4119509;PIRAQUARA;10832;F01946;PENITENCIÁRIA ESTADUAL DE PIRAQUARA II
PR;4119509;PIRAQUARA;10835;F02480;UNIDADE DE PROGRESSÃO PCE UP
PR;4119509;PIRAQUARA;10838;F03519;CENTRO DE INTEGRAÇÃO SOCIAL DE PIRAQUARA  CIS
PR;4119509;PIRAQUARA;10837;F01452;PENITENCIARIA FEMININA DO PARANÁ
PR;4119509;PIRAQUARA;10829;F01198;PENITENCIÁRIA ESTADUAL DE PIRAQUARA
PR;4119905;PONTA GROSSA;10887;F03515;PENITENCIÁRIA ESTADUAL DE PONTA GROSSA  UNIDADE DE PROGRESSÃO  PEPG UP
PR;4119905;PONTA GROSSA;10888;F00375;CADEIA PÚBLICA HILDEBRANDO DE SOUZA
PR;4119905;PONTA GROSSA;10884;F03264;COMPLEXO SOCIAL DO PONTA GROSSA
PR;4119905;PONTA GROSSA;10885;F02000;CENSE PONTA GROSSA
PR;4119905;PONTA GROSSA;10886;F03514;PENITENCIÁRIA ESTADUAL DE PONTA GROSSA  UNIDADE DE SEGURANÇA  PEPG US
PR;4120002;PORECATU;10797;F06722;CADEIA PÚBLICA DE PORECATU
PR;4122404;ROLANDIA;10868;F06743;CADEIA PÚBLICA DE ROLÂNDIA
PR;4124103;SANTO ANTONIO DA PLATINA;10856;F01256;CENSE SANTO ANTONIO DA PLATINA
PR;4124103;SANTO ANTONIO DA PLATINA;10857;F04768;CADEIA PÚBLICA DE SANTO ANTÔNIO DA PLATINA
PR;4125506;SAO JOSE DOS PINHAIS;10839;F01686;CASA DE CUSTÓDIA DE SÃO JOSÉ DOS PINHAIS
PR;4125506;SAO JOSE DOS PINHAIS;10840;F02482;CENSE SÃO JOSÉ DOS PINHAIS
PR;4127106;TELEMACO BORBA;10889;F03189;CADEIA PÚBLICA DE TELÊMACO BORBA
PR;4127700;TOLEDO;10808;F06961;APAC TOLEDO
PR;4127700;TOLEDO;10805;F03562;PATRONATO PENITENCIÁRIO DE TOLEDO
PR;4127700;TOLEDO;10809;F01998;CENSE TOLEDO
PR;4127700;TOLEDO;10807;F06782;COMPLEXO SOCIAL TOLEDO
PR;4127700;TOLEDO;10806;F03284;CADEIA PÚBLICA DE TOLEDO
PR;4128104;UMUARAMA;10878;F01999;CENSE UMUARAMA
PR;4128500;WENCESLAU BRAZ;10846;F02326;CADEIA PÚBLICA WENCESLAU BRAZ
RJ;3300407;BARRA MANSA;10960;F02068;CRIAAD BARRA MANSA
RJ;3300456;BELFORD ROXO;10931;F01070;CAI BELFORD ROXO
RJ;3300704;CABO FRIO;10913;F01340;CRIAAD CABO FRIO
RJ;3301009;CAMPOS DOS GOYTACAZES;10921;F01824;CENSE CAMPOS PROFESSORA MARLENE HENRIQUE ALVES
RJ;3301009;CAMPOS DOS GOYTACAZES;10923;F00531;CENTRO DE RECURSOS INTEGRADOS DE ATENDIMENTO AO ADOLESCENTE  CRIAAD CAMPOS
RJ;3301009;CAMPOS DOS GOYTACAZES;10924;F00692;PRESÍDIO CARLOS TINOCO DA FONSECA
RJ;3301009;CAMPOS DOS GOYTACAZES;10925;F01984;CADEIA PÚBLICA DALTON CRESPO DE CASTRO
RJ;3301009;CAMPOS DOS GOYTACAZES;10922;F00430;PRESÍDIO FEMININO DE CAMPOS
RJ;3301702;DUQUE DE CAXIAS;10920;F00530;CRIAAD DUQUE DE CAXIAS
RJ;3302205;ITAPERUNA;10934;F01727;PRESÍDIO DIOMEDES VINHOSA MUNIZ
RJ;3302270;JAPERI;10941;F01728;CADEIA PÚBLICA COTRIN NETO
RJ;3302270;JAPERI;10940;F00992;CADEIA PÚBLICA COTRIM NETO
RJ;3302270;JAPERI;10939;F00158;PENITENCIÁRIA MILTON DIAS MOREIRA   I
RJ;3302403;MACAE;10958;F00229;CRIAAD MACAE
RJ;3302502;MAGE;10936;F00993;CADEIA PÚBLICA HÉLIO GOMES
RJ;3302502;MAGE;10937;F01490;COLÔNIA AGRÍCOLA MARCO AURÉLIO VERGAS TAVARES DE MATOS
RJ;3302502;MAGE;10935;F00425;CADEIA PÚBLICA ROMEIRO NETO
RJ;3303203;NILOPOLIS;10932;F01574;CENTRO DE RECURSOS INTEGRADOS DE ATENDIMENTO AO ADOLESCENTE  CRIAAD NILÓPOLIS
RJ;3303302;NITEROI;10930;F02067;CRIAAD NITERÓI
RJ;3303302;NITEROI;10929;F00693;CASA DO ALBERGADO CORONEL PM FRANCISCO SPARGOLI ROCHA
RJ;3303302;NITEROI;10927;F00143;INSTITUTO PENAL EDGARD COSTA
RJ;3303302;NITEROI;10928;F01730;HOSPITAL DE CUSTÓDIA E TRATAMENTO PSIQUIÁTRICO HENRIQUE ROXO
RJ;3303401;NOVA FRIBURGO;10926;F02585;CENSE NOVA FRIBURGO DR ANTÔNIO ELIAS DOREA DE ARAÚJO BASTOS
RJ;3304557;NOVA IGUACU;10933;F00529;CRIAAD NOVA IGUAÇU
RJ;3303500;NOVA IGUACU;10933;F00529;CRIAAD NOVA IGUAÇU
RJ;3304110;PORTO REAL;10938;F02545;PENITENCIÁRIA INSPETOR LUÍS FERNANDES BANDEIRA DUARTE
RJ;3304557;RIO DE JANEIRO;10909;F03621;INSTITUTO PENAL SANTO EXPEDITO
RJ;3304557;RIO DE JANEIRO;10899;F00973;CADEIA PÚBLICA JORGE SANTANA
RJ;3304557;RIO DE JANEIRO;10912;F00978;PRESÍDIO JOÃO CARLOS DA SILVA
RJ;3304557;RIO DE JANEIRO;10898;F00705;CADEIA PÚBLICA INSPETOR JOSÉ ANTÔNIO DA COSTA BARROS
RJ;3304557;RIO DE JANEIRO;10943;F00704;INSTITUTO PENAL OSCAR STEVENSON
RJ;3304557;RIO DE JANEIRO;10893;F00139;PENITENCIÁRIA MONIZ SODRÉ
RJ;3304557;RIO DE JANEIRO;10944;F01985;CASA DO ALBERGADO CRISPIN VENTINO
RJ;3304557;RIO DE JANEIRO;10911;F01504;CADEIA PÚBLICA BANDEIRA STAMPA
RJ;3304557;RIO DE JANEIRO;10895;F00424;PRESÍDIO NELSON HUNGRIA
RJ;3304557;RIO DE JANEIRO;10949;F01069;CENTRO DE SOCIOEDUCAÇÃO DOM BOSCO
RJ;3304557;RIO DE JANEIRO;10947;F03322;CRIAAD BONSUCESSO
RJ;3304557;RIO DE JANEIRO;10914;F01485;INSTITUTO PENAL CÂNDIDO MENDES
RJ;3304557;RIO DE JANEIRO;10908;F00779;CRIAAD BANGU
RJ;3304557;RIO DE JANEIRO;10901;F01240;CADEIA PÚBLICA PAULO ROBERTO ROCHA
RJ;3304557;RIO DE JANEIRO;10954;F01825;CAMPUS CECEL  COORDENAÇÃO DE EDUCAÇÃO CULTURA ESPORTE E LAZER
RJ;3304557;RIO DE JANEIRO;10952;F03523;CENTRO DE SOCIOEDUCATIVO ILHA DO GOVERNADOR
RJ;3304557;RIO DE JANEIRO;10919;F01503;PRESÍDIO ARY FRANCO
RJ;3304557;RIO DE JANEIRO;10950;F03504;CENSE MARIA LUIZA MARCATE RAMOS
RJ;3304557;RIO DE JANEIRO;10946;F00422;PRESÍDIO EVARISTO DE MORAES
RJ;3304557;RIO DE JANEIRO;10900;F00974;PENITENCIÁRIA GABRIEL FERREIRA DE CASTILHO
RJ;3304557;RIO DE JANEIRO;10905;F01484;PENITENCIÁRIA JONAS LOPES DE CARVALHO
RJ;3304557;RIO DE JANEIRO;10948;F00532;CENTRO DE SOCIOEDUCAÇÃO PROFESSOR  ANTONIO CARLOS GOMES DA COSTA
RJ;3304557;RIO DE JANEIRO;10915;F00142;PENITENCIÁRIA LEMOS  BRITO
RJ;3304557;RIO DE JANEIRO;10951;F03321;CRIAAD ILHA DO GOVERNADOR
RJ;3304557;RIO DE JANEIRO;10910;F01339;CRIAAD SANTA CRUZ
RJ;3304557;RIO DE JANEIRO;10892;F00141;UNIDADE MATERNO INFANTIL
RJ;3304557;RIO DE JANEIRO;10918;F01483;PENITENCIÁRIA ALFREDO TRANJAN
RJ;3304557;RIO DE JANEIRO;10953;F00533;ESCOLA JOÃO LUIS ALVES
RJ;3304557;RIO DE JANEIRO;10903;F01242;CADEIA PÚBLICA PEDRO MELO DA SILVA
RJ;3304557;RIO DE JANEIRO;10916;F01731;PENITENCIÁRIA MILTON DIAS MOREIRA
RJ;3304557;RIO DE JANEIRO;10945;F02587;JOSÉ FREDERICO MARQUES  SEAP  FM
RJ;3304557;RIO DE JANEIRO;10896;F00689;PRESÍDIO ELIZABETH SÁ REGO
RJ;3304557;RIO DE JANEIRO;10904;F01243;PENITENCIÁRIA VICENTE PIRAGIBE
RJ;3304557;RIO DE JANEIRO;10894;F00144;CADEIA PÚBLICA JOAQUIM FERREIRA DE SOUZA
RJ;3304557;RIO DE JANEIRO;10890;F00147;PENITENCIÁRIA TALAVERA BRUCE
RJ;3304557;RIO DE JANEIRO;10942;F00443;PATRONATO MAGARINO TORRES
RJ;3304557;RIO DE JANEIRO;10906;F01729;INSTITUTO PENAL BENJAMIN DE MORAES FILHO
RJ;3304557;RIO DE JANEIRO;10897;F00691;PENITENCIÁRIA DR SERRANO NEVES
RJ;3304557;RIO DE JANEIRO;10902;F01241;PENITENCIÁRIA INDUSTRIAL ESMERALDINO BANDEIRA
RJ;3304557;RIO DE JANEIRO;10891;F00975;HOSPITAL SANATÓRIO PENAL
RJ;3304557;RIO DE JANEIRO;10907;F01983;INSTITUTO PENAL PLÁCIDO SÁ CARVALHO
RJ;3304557;RIO DE JANEIRO;10917;F00444;CADEIA PÚBLICA CONSTANTINO COKOTÓS
RJ;3304904;SAO GONCALO;10955;F01341;CENTRO DE RECURSOS INTEGRADOS DE ATENDIMENTO AO ADOLESCENTE  CRIAAD SÃO GONÇALO
RJ;3304904;SAO GONCALO;10957;F01996;CADEIA PÚBLICA ISAP TIAGO TELES DE CASTRO DOMINGUES
RJ;3304904;SAO GONCALO;10956;F00446;CADEIA PÚBLICA PATRÍCIA ACIOLI
RJ;3305802;TERESOPOLIS;10959;F01338;CRIAAD TERESOPOLIS INES JOAQUINA SANTANA SANTOS COUTINHO
RJ;3306305;VOLTA REDONDA;10963;F02066;CRIAAD VOLTA REDONDA
RJ;3306305;VOLTA REDONDA;10961;F00140;CADEIA PÚBLICA FRANZ DE CASTRO HOLZWARTH
RJ;3306305;VOLTA REDONDA;10962;F01822;CENSE VOLTA REDONDA  IRMÃ ASSUNIÓN DE LA GÁNDARA USTARA
RN;2401008;APODI;10965;F03061;CDP APODÍ CENTRO DE DETENÇÃO PROVISÓRIA DE APODÍ
RN;2402006;CAICO;10964;F00455;PENITENCIARIA ESTADUAL DO SERIDO
RN;2402303;CARAUBAS;10966;F00456;CADEIA PUBLICA DE CARAUBAS
RN;2402600;CEARA-MIRIM;10971;F03183;CADEIA PÚBLICA DINORÁ SIMAS LIMA DEODATO
RN;2408003;MOSSORO;10970;F00168;COMPLEXO PENAL ESTADUAL AGRICOLADR MARIO NEGOCIO
RN;2408003;MOSSORO;10969;F06901;ESCRITÓRIO SOCIAL DE MOSSORÓ
RN;2408003;MOSSORO;10968;F00550;PENITENCIÁRIA FEDERAL EM MOSSORÓRN
RN;2408003;MOSSORO;10967;F00713;CADEIA PUBLICA DE MOSSORO
RN;2408102;NATAL;10974;F02011;UNIDADE PSIQUIATRICA DE CUSTORIA E TRATAMENTO DE NATAL
RN;2408102;NATAL;10972;F02012;COMPLEXO PENAL DE JOAO CHAVES
RN;2408102;NATAL;10975;F01003;PENITENCIARIA JOAO CHAVES
RN;2408102;NATAL;10973;F02010;CADEIA PUBLICA DE NATAL
RN;2408201;NISIA FLORESTA;10976;F00166;PENITENCIÁRIA FRANCISCO NOGUEIRA FERNANDES  ALÇAÇUZ
RN;2408201;NISIA FLORESTA;10977;F01746;PENITENCIÁRIA ESTADUAL ROGÉRIO COUTINHO MADRUGA
RN;2408300;NOVA CRUZ;10978;F01511;CADEIA PÚBLICA NOMINANDO GOMES NOVA CRUZ
RN;2403251;PARNAMIRIM;10979;F02284;CENTRO DE DETENÇÃO PROVISÓRIA DE PARNAMIRIM  FEMININO
RN;2403251;PARNAMIRIM;10980;F01512;PENITENCIARIA ESTADUAL DE PARNAMIMIM
RN;2409407;PAU DOS FERROS;10982;F06921;COMPLEXO PENAL ESTADUAL AGRÍCOLA MÁRIO NEGÓCIO FEMININO
RN;2409407;PAU DOS FERROS;10981;F00165;COMPLEXO PENAL REGIONAL DE PAU DOS FERROS
RO;1100015;ALTA FLORESTA D OESTE;11020;F00591;CASA DE DETENÇÃO DE ALTA FLORESTA DOESTERO
RO;1100346;ALVORADA D OESTE;10997;F00830;CENTRO DE RESSOCIALIZAÇÃO DE ALVORADA DO OESTE
RO;1100023;ARIQUEMES;10985;F01873;CASA DO ALBERGADO E PRESIDIO FEMININO DE ARIQUEMES
RO;1100023;ARIQUEMES;10984;F00031;CENTRO DE RESSOCIALIZAÇÃO DE ARIQUEMES
RO;1100023;ARIQUEMES;10983;F00935;UNIDADE SOCIOEDUCATIVA DE ARIQUEMES
RO;1100452;BURITIS;10986;F00291;CENTRO DE RESSOCIALIZAÇÃO JONAS FERRETI
RO;1100049;CACOAL;10988;F01213;UNIDADE SOCIOEDUCATIVA DE CACOAL
RO;1100049;CACOAL;10987;F00595;CASA DE DETENÇÃO DE CACOAL
RO;1100056;CEREJEIRAS;11026;F01876;COLÔNIA PENAL AGRÍCOLA DE PORTO VELHO
RO;1100064;COLORADO DO OESTE;11027;F00831;CADEIA PUBLICA DE COLORADO DOESTE COMPARTILHADA
RO;1100080;COSTA MARQUES;10990;F00033;CADEIA PÚBLICA DE COSTA MARQUES
RO;1100106;GUAJARA-MIRIM;10991;F00586;PENITENCIÁRIA DE NOVA MAMORÉ
RO;1100106;GUAJARA-MIRIM;10993;F00829;CASA DE DETENÇÃO FEMININA DE GUAJARÁ MIRIM
RO;1100106;GUAJARA-MIRIM;10992;F00588;CASA DE DETENÇÃO DE GUAJARA - MIRIM
RO;1100114;JARU;10995;F01131;CASA DE PRISÃO ALBERGUE DE JARU
RO;1100114;JARU;10994;F00026;CENTRO R DE RESSOCIALIZAÇÃO AUGUSTO SIMON KEMPE
RO;1100122;JI-PARANA;10998;F03169;PRESIDIO SEMIABERTO DE  JIPARANA
RO;1100122;JI-PARANA;11002;F00032;CASA DE DETENÇÃO DE JIPARANA
RO;1100122;JI-PARANA;10999;F00934;UNIDADE SOCIOEDUCATIVA DE JIPARANÁ
RO;1100122;JI-PARANA;11000;F03265;ASSISTÊNCIA DE PROTEÇÃO AOS CONDENADOS  APAC
RO;1100122;JI-PARANA;11001;F00030;PENITENCIÁRIA REGIONAL DR AGENOR MARTINS DE CARVALHO
RO;1100130;MACHADINHO D OESTE;10996;F04449;CENTRO DE RESSOCIALIZAÇÃO DE MACHADINHO DOESTE
RO;1100155;OURO PRETO DO OESTE;11003;F00589;CASA DE DETENÇÃO DE OURO PRETO DO OESTE
RO;1100189;PIMENTA BUENO;10989;F01129;CASA DE DETENÇÃO DE PIMENTA BUENO
RO;1100205;PORTO VELHO;11013;F00827;PENITENCIÁRIA ESTADUAL ARUANA
RO;1100205;PORTO VELHO;11012;F01467;UNIDADE DE INTERNAÇÃO PROVISÓRIA
RO;1100205;PORTO VELHO;11006;F01878;PENITENCIARIA  ESTADUAL SUELY  MARIA MENDOÇA
RO;1100205;PORTO VELHO;11016;F01622;PENITENCIÁRIA EDVAN MARIANO ROSENDO  PANDA
RO;1100205;PORTO VELHO;11010;F04421;PATRONATO PORTO VELHO
RO;1100205;PORTO VELHO;11009;F01468;UNIDADE SOCIOEDUCATIVA FEMININA
RO;1100205;PORTO VELHO;11019;F01875;COLONIA AGRICOLA PENAL ENIO PINHEIRO
RO;1100205;PORTO VELHO;11008;F00800;PENITENCIÁRIA FEDERAL EM PORTO VELHO
RO;1100205;PORTO VELHO;11011;F06725;CASSEMCENTRO ATENDIMENTO SOCIOEDUCATIVO SEMILIBERDADE
RO;1100205;PORTO VELHO;11005;F00288;PENITENCIÁRIA DE MÉDIO PORTE DE PORTO VELHO
RO;1100205;PORTO VELHO;11014;F01387;PROVISÓRIO MASC DR JOSÉ MARIO ALVES  URSO BRANCO
RO;1100205;PORTO VELHO;11018;F06288;UNIDADE MASCULINA SENTENCIADA II
RO;1100205;PORTO VELHO;11015;F01388;CENTRO DE RESSOCIALIZAÇÃO VALE DO GUAPORÉ
RO;1100205;PORTO VELHO;11017;F03288;PENITENCIÁRIA ESTADUAL JORGE THIAGO AGUIAR AFONSO
RO;1100205;PORTO VELHO;11007;F04631;PENITENCIÁRIA ESTADUAL MILTON SOARES DE CARVALHO
RO;1100254;PRESIDENTE MEDICI;11004;F00286;CADEIA PUBLICA DE PRESIDENTE MÉDICE
RO;1100288;ROLIM DE MOURA;11021;F00027;PENITENCIÁRIA REGIONAL DE ROLIM DE MOURA
RO;1100288;ROLIM DE MOURA;11023;F00290;CASA DE PRISÃO SEMIABERTO DE ROLIM DE MOURA
RO;1100288;ROLIM DE MOURA;11022;F01703;CENTRO SOCIOEDUCATIVO DE ROLIM DE MOURA
RO;1101492;SAO FRANCISCO DO GUAPORE;11024;F00835;CADEIA PÚBLICA DE SÃO FRANCISCO DO GUAPORÉ
RO;1100320;SAO MIGUEL DO GUAPORE;11025;F01133;CASA DE DETENÇÃO DE SÃO MIGUEL DO GUAPORÉ
RO;1100304;VILHENA;11030;F01954;UNIDADE SOCIOEDUCATIVA DE VILHENA
RO;1100304;VILHENA;11029;F00587;CENTRO DE RESSOCIALIZAÇÃO DO CONE SUL
RO;1100304;VILHENA;11028;F00289;COLÔNIA PENAL MONITORAMENTO E P FEMININO ELETRÔNICO VILHENA
RR;1400100;BOA VISTA;11035;F02266;CENTRO SOCIOEDUCATIVO HOMERO SOUZA CRUZ FILHO
RR;1400100;BOA VISTA;11031;F05126;COMANDO DE POLICIAMENTO DA CAPITAL
RR;1400100;BOA VISTA;11036;F05241;PENITENCIÁRIA AGRÍCOLA DE MONTE CRISTO
RR;1400100;BOA VISTA;11034;F00837;CASA DO ALBERGADO PROFESSORA ARACELIS SOUTO MAIOR DE BOA VISTA  CABV
RR;1400100;BOA VISTA;11033;F01136;CENTRO DE PROGRESSÃO PENITENCIÁRIA  CPP
RR;1400100;BOA VISTA;11032;F05128;CADEIA PÚBLICA MASCULINA DE BOA VISTA  CPMBV
RR;1400100;BOA VISTA;11037;F01135;CADEIA PÚBLICA MASCULINA DE BOA VISTA
RS;4300109;AGUDO;11038;F00415;PRESÍDIO ESTADUAL DE AGUDO
RS;4300406;ALEGRETE;11107;F01233;PRESÍDIO ESTADUAL DE ALEGRETE
RS;4301008;ARROIO DO MEIO;11117;F01976;PRESÍDIO ESTADUAL DE ARROIO DO MEIO
RS;4301107;ARROIO DOS RATOS;11039;F00131;PENITENCIÁRIA ESTADUAL DE ARROIO DOS RATOS
RS;4301602;BAGE;11040;F00678;PRESIDIO REGIONAL DE BAGE
RS;4302105;BENTO GONCALVES;11044;F00411;PENITENCIÁRIA ESTADUAL DE BENTO GONÇALVES
RS;4302808;CACAPAVA DO SUL;11131;F01719;PRESÍDIO ESTADUAL DE CAÇAPAVA DO SUL
RS;4302907;CACEQUI;11043;F00402;PRESÍDIO ESTADUAL DE CACEQUI
RS;4303004;CACHOEIRA DO SUL;11118;F01968;PRESÍDIO ESTADUAL DE CACHOEIRA DO SUL
RS;4303509;CAMAQUA;11100;F00967;PRESÍDIO ESTADUAL DE CAMAQUÃ
RS;4304200;CANDELARIA;11042;F00414;PRESÍDIO ESTADUAL DE CANDELÁRIA
RS;4304408;CANELA;11045;F01479;PRESÍDIO ESTADUAL DE CANELA
RS;4304507;CANGUCU;11101;F01482;PRESIDIO ESTADUAL DE CANCUÇU
RS;4304606;CANOAS;11066;F02187;PENITENCIARIA ESTADUAL DE CANOAS I  PECAN I
RS;4304606;CANOAS;11069;F03087;PENITENCIÁRIA ESTADUAL DE CANOAS IV  PECAN IV
RS;4304606;CANOAS;11068;F03049;PENITENCIÁRIA ESTADUAL DE CANOAS III  PECAN III
RS;4304606;CANOAS;11067;F02549;PENITENCIÁRIA ESTADUAL DE CANOAS II  PECAN II
RS;4305108;CAXIAS DO SUL;11048;F00130;PENITENCIÁRIA ESTADUAL DE CAXIAS DO SUL
RS;4305108;CAXIAS DO SUL;11047;F01957;PRESIDIO REGIONAL DE CAXIAS DO SUL
RS;4305108;CAXIAS DO SUL;11046;F01104;CASE REGIONAL CAXIAS DO SUL
RS;4305355;CHARQUEADAS;11054;F01707;INSTITUTO PENAL DE CHARQUEADAS
RS;4305355;CHARQUEADAS;11057;F02263;ANEXO REGIME SEMI ABERTO DA PENITENCIARIA ESTADUAL DO JACUI  PEJ
RS;4305355;CHARQUEADAS;11053;F00685;PENITENCIÁRIA MODULADA ESTADUAL DE CHARQUEADAS
RS;4305355;CHARQUEADAS;11056;F01975;PENITENCIÁRIA DE ALTA SEGURANÇA DE CHARQUEADAS
RS;4305355;CHARQUEADAS;11051;F00123;COLÔNIA PENAL AGRÍCOLA GAL DALTRO FILHO
RS;4305355;CHARQUEADAS;11055;F01958;PENITENCIÁRIA ESTADUAL DO JACUÍ
RS;4305355;CHARQUEADAS;11052;F00683;PENITENCIÁRIA ESTADUAL DE CHARQUEADAS
RS;4306106;CRUZ ALTA;11060;F01226;PRESÍDIO ESTADUAL DE CRUZ ALTA
RS;4306601;DOM PEDRITO;11041;F00401;PRESÍDIO ESTADUAL DE DOM PEDRITO
RS;4306809;ENCANTADO;11119;F01972;PRESÍDIO ESTADUAL DE ENCANTADO
RS;4306908;ENCRUZILHADA DO SUL;11120;F01967;PRESÍDIO ESTADUAL DE ENCRUZILHADA DO SUL
RS;4307005;ERECHIM;11090;F01231;PRESÍDIO ESTADUAL DE ERECHIM
RS;4307500;ESPUMOSO;11091;F00120;PRESÍDIO ESTADUAL DE ESPUMOSO
RS;4308508;FREDERICO WESTPHALEN;11061;F00940;PRESÍDIO ESTADUAL DE FREDERICO WESTPHALEN
RS;4308904;GETULIO VARGAS;11092;F01705;PRESÍDIO ESTADUAL DE GETÚLIO VARGAS
RS;4309209;GRAVATAI;11078;F00682;INSTITUTO PENAL DE GRAVATAI SANTOS E MEDEIROS
RS;4309308;GUAIBA;11058;F00407;PENITENCIÁRIA FEMININA ESTADUAL DE GUAÍBA
RS;4309407;GUAPORE;11093;F00133;PRESÍDIO ESTADUAL DE GUAPORÉ
RS;4310207;IJUI;11062;F00381;PENITENCIÁRIA MODULADA ESTADUAL DE IJUÍ
RS;4310504;IRAI;11063;F01230;PRESÍDIO ESTADUAL DE IRAÍ
RS;4310603;ITAQUI;11129;F01706;PRESÍDIO ESTADUAL DE ITAQUI
RS;4311106;JAGUARI;11065;F00963;PRESÍDIO ESTADUAL DE JAGUARI
RS;4311205;JULIO DE CASTILHOS;11132;F00684;PRESÍDIO ESTADUAL DE JULIO DE CASTILHOS
RS;4311304;LAGOA VERMELHA;11094;F00383;PRESÍDIO ESTADUAL DE LAGOA VERMELHA
RS;4311403;LAJEADO;11121;F00384;PRESÍDIO ESTADUAL DE LAJEADO
