SG_UF_PROVA;CO_MUNICIPIO_PROVA;NO_MUNICIPIO_PROVA;CO_COORDENACAO;CO_LOCAL;NO_LOCAL_PROVA
MG;3128303;GUARANESIA;10321;F00742;PRESÍDIO DE GUARANÉSIA I
MG;3130903;INHAPIM;10336;F02245;APAC INHAPIM
MG;3131158;IPABA;10334;F00484;PENITENCIÁRIA DE IPABA I
MG;3131307;IPATINGA;10458;F01771;CENTRO DE REMANEJAMENTO IPATINGA
MG;3131307;IPATINGA;10457;F01066;CENTRO SOCIOEDUCATIVO DE IPATINGA
MG;3131901;ITABIRITO;10318;F05181;APAC DE ITABIRITO
MG;3132404;ITAJUBA;10503;F01525;PRESIDIO DE ITAJUBA
MG;3132503;ITAMARANDIBA;10419;F02448;PRESÍDIO DE ITAMARANDIBA
MG;3133303;ITAOBIM;10463;F00175;PRESIDIO DE ITAOBIM I
MG;3133402;ITAPAGIPE;10347;F02449;PRESÍDIO DE ITAPAGIPE
MG;3133808;ITAUNA;10443;F00984;PRESIDIO DE ITAUNA
MG;3133808;ITAUNA;10445;F01736;APAC MASCULINA DE ITAÚNA
MG;3133808;ITAUNA;10444;F00989;APAC FEMININA DE ITAÚNA
MG;3134202;ITUIUTABA;10485;F00200;APAC DE ITUIUTABA
MG;3134202;ITUIUTABA;10486;F00157;PRESÍDIO DE ITUIUTABA
MG;3134608;JABOTICATUBAS;10317;F01501;PRESÍDIO DE JABOTICATUBAS
MG;3134707;JACINTO;10329;F02412;PRESÍDIO DE JACINTO
MG;3135100;JANAUBA;10472;F00737;PRESIDIO DE JANAUBA
MG;3135209;JANUARIA;10478;F01783;APAC DE JANUÁRIA I
MG;3135209;JANUARIA;10477;F01763;PRESIDIO DE JANUARIA
MG;3135803;JEQUITINHONHA;10328;F01301;PRESÍDIO DE JEQUITINHONHA
MG;3136207;JOAO MONLEVADE;10314;F00203;PRESIDIO DE JOAO MONLEVADE
MG;3136306;JOAO PINHEIRO;10332;F01287;PRESIDIO DE JOAO PINHEIRO
MG;3136652;JUATUBA;10313;F01275;PRESIDIO DE JUATUBA
MG;3136702;JUIZ DE FORA;10466;F01757;CASA DO ALBERGADO JOSE ALENCAR ROGEDO
MG;3136702;JUIZ DE FORA;10469;F01821;CENTRO SOCIOEDUCATIVO JUIZ DE FORA  CSEJF
MG;3136702;JUIZ DE FORA;10468;F06006;PENITENCIÁRIA DE JUIZ DE FORA II
MG;3136702;JUIZ DE FORA;10467;F00726;PENITENCIARIA JOSE EDSON CAVALIERI
MG;3137205;LAGOA DA PRATA;10361;F00489;PRESIDIO DE LAGOA DA PRATA
MG;3137205;LAGOA DA PRATA;10360;F00985;APAC DE LAGOA DA PRATA
MG;3138401;LEOPOLDINA;10385;F00487;PRESIDIO DE LEOPOLDINA
MG;3139003;MACHADO;10461;F02413;PRESÍDIO DE MACHADO
MG;3139201;MALACACHETA;10327;F02451;PRESÍDIO DE MALACACHETA
MG;3139300;MANGA;10471;F01541;PRESÍDIO DE MANGA
MG;3139409;MANHUACU;10389;F00154;APAC DE MANHUACU
MG;3139508;MANHUMIRIM;10349;F00983;PRESÍDIO DE MANHUMIRIM
MG;3139508;MANHUMIRIM;10350;F04480;APAC MANHUMIRIM
MG;3139607;MANTENA;10437;F01782;PRESÍDIO DE MANTENA
MG;3140001;MARIANA;10331;F01273;PRESIDIO DE MARIANA
MG;3143104;MONTE CARMELO;10493;F00152;PRESÍDIO DE MONTE CARMELO
MG;3143302;MONTES CLAROS;10476;F00526;CENTRO SOCIOEDUCATIVO MONTES CLAROS  CSEMC
MG;3119104;MONTES CLAROS;10475;F00735;PRESIDIO REGIONAL DE MONTES CLAROS
MG;3143302;MONTES CLAROS;10474;F01785;PRESIDIO DE MONTES CLAROS I
MG;3143302;MONTES CLAROS;10475;F00735;PRESIDIO REGIONAL DE MONTES CLAROS
MG;3143906;MURIAE;10390;F00486;PRESIDIO DE MURIAE
MG;3143906;MURIAE;10391;F00197;PENITENCIARIA DOUTOR MANUEL MARTINS LISBOA JUNIOR
MG;3144300;NANUQUE;10422;F01543;PRESIDIO REGIONAL DE NANUQUE
MG;3144607;NEPOMUCENO;10337;F02414;PRESÍDIO DE NEPOMUCENO I
MG;3144706;NOVA ERA;10446;F02454;PRESÍDIO DE NOVA ERA
MG;3144805;NOVA LIMA;10382;F00436;APAC  DE NOVA LIMA
MG;3145604;OLIVEIRA;10326;F00153;PRESÍDIO DR NELSON PIRES
MG;3146107;OURO PRETO;10447;F01283;PRESIDIO DE OURO PRETO
MG;3147105;PARA DE MINAS;10448;F01274;PENITENCIÁRIA DE PARÁ DE MINAS I
MG;3147006;PARACATU;10393;F00991;PRESÍDIO DE PARACATU
MG;3147006;PARACATU;10392;F00155;APAC DE PARACATU
MG;3147907;PASSOS;10395;F02031;APAC DE PASSOS I
MG;3147907;PASSOS;10394;F06441;CENTRO SOCIOEDUCATIVO DE PASSOS
MG;3148004;PATOS DE MINAS;10396;F02471;APAC PATOS DE MINAS
MG;3148103;PATROCINIO;10397;F00699;APAC DE PATROCÍNIO
MG;3148103;PATROCINIO;10398;F01779;PENITENCIARIA DEPUTADO EXPEDITO DE FARIA TAVARES
MG;3118601;PATROCINIO;10398;F01779;PENITENCIARIA DEPUTADO EXPEDITO DE FARIA TAVARES
MG;3148707;PEDRA AZUL;10423;F01502;APAC PEDRA AZUL
MG;3149903;PERDOES;10359;F01252;APAC DE PERDÕES
MG;3151206;PIRAPORA;10399;F02184;PRESÍDIO DE PIRAPORA
MG;3151206;PIRAPORA;10400;F01540;APAC DE PIRAPORA I
MG;3151206;PIRAPORA;10401;F04420;CENTRO SOCIOEDUCATIVO DE PIRAPORA
MG;3151503;PIUMHI;10325;F00986;PRESIDIO DE PIUMHI I
MG;3152105;PONTE NOVA;10449;F01282;COMPLEXO PENITENCIARIO DE PONTE NOVA
MG;3152501;POUSO ALEGRE;10403;F00485;PRESIDIO DE POUSO ALEGRE
MG;3152501;POUSO ALEGRE;10402;F02182;APAC FEMIININA DE POUSO ALEGRE
MG;3152501;POUSO ALEGRE;10404;F00439;APAC DE POUSO ALEGRE
MG;3152808;PRATA;10340;F00196;PRESIDIO DE PRATA
MG;3153400;PRESIDENTE OLEGARIO;10310;F00719;PRESIDIO DE PRESIDENTE OLEGARIO I ELZI ALVES DE OLIVEIRA
MG;3154200;RESENDE COSTA;10465;F02455;PRESÍDIO  DE RESENDE COSTA
MG;3154606;RIBEIRAO DAS NEVES;10426;F00201;CENTRO DE APOIO MEDICO E PERICIAL DE RIBEIRAO DAS NEVES I
MG;3154606;RIBEIRAO DAS NEVES;10427;F00718;PARCERIA PUBLICO PRIVADA  UNIDADE I
MG;3154606;RIBEIRAO DAS NEVES;10429;F01993;COMPLEXO PENAL PPP  UNIDADE III
MG;3154606;RIBEIRAO DAS NEVES;10430;F00178;PRESIDIO FEMININO JOSE ABRANCHES GONCALVES
MG;3154606;RIBEIRAO DAS NEVES;10431;F00738;PRESIDIO INSPETOR JOSE MARTINHO DRUMOND
MG;3154606;RIBEIRAO DAS NEVES;10428;F01780;PENITENCIARIA JOSE MARIA ALKIMIN
MG;3154606;RIBEIRAO DAS NEVES;10432;F01023;PRESIDIO ANTONIO DUTRA LADEIRA
MG;3154606;RIBEIRAO DAS NEVES;10425;F00199;COMPLEXO PENAL PPP  UNIDADE II
MG;3118601;RIBEIRAO DAS NEVES;10428;F01780;PENITENCIARIA JOSE MARIA ALKIMIN
MG;3154606;RIBEIRAO DAS NEVES;10433;F02061;CENTRO SOCIOEDUCATIVO DE RIBEIRÃO DAS NEVES  CSERN
MG;3155702;RIO PIRACICABA;10315;F01781;APAC  FEMININA DE RIO PIRACICABA
MG;3155801;RIO POMBA;10344;F02473;PRESÍDIO  DE RIO POMBA
MG;3157005;SALINAS;10479;F02183;APAC SALINAS
MG;3157203;SANTA BARBARA;10322;F01027;APAC SANTA BÁRBARA
MG;3157807;SANTA LUZIA;10380;F00988;APAC SANTA LUZIA I
MG;3157807;SANTA LUZIA;10381;F01765;PRESIDIO DE SANTA LUZIA
MG;3158201;SANTA MARIA DO SUACUI;10346;F00698;APAC DE SANTA MARIA DO SUACUI
MG;3159605;SANTA RITA DO SAPUCAI;10358;F06121;PRESÍDIO DE SANTA RITA DO SAPUCAÍ I
MG;3159803;SANTA VITORIA;10498;F02458;PRESÍDIO  DE SANTA VITÓRIA
MG;3160702;SANTOS DUMONT;10470;F01545;PRESIDIO SANTOS DUMONT
MG;3161007;SAO DOMINGOS DO PRATA;10316;F02474;PRESÍDIO  DE SÃO DOMINGOS DA PRATA
MG;3161106;SAO FRANCISCO;10352;F00702;PRESIDIO DE SAO FRANCISCO
MG;3162500;SAO JOAO DEL REI;10407;F02287;APAC FEMININA DE SÃO JOÃO DEL REI
MG;3162500;SAO JOAO DEL REI;10405;F01755;PRESIDIO DE SAO JOAO DEL REI
MG;3162500;SAO JOAO DEL REI;10406;F00156;APAC DE SÃO JOÃO DEL REI
MG;3162922;SAO JOAQUIM DE BICAS;10368;F01304;PENITENCIARIA PROFESSOR JASON SOARES ALBERGARIA
MG;3162922;SAO JOAQUIM DE BICAS;10369;F01307;PRESIDIO DE SAO JOAQUIM DE BICAS II
MG;3162922;SAO JOAQUIM DE BICAS;10367;F00174;PRESIDIO DE SAO JOAQUIM DE BICAS I
MG;3154606;SAO JOAQUIM DE BICAS;10369;F01307;PRESIDIO DE SAO JOAQUIM DE BICAS II
MG;3163706;SAO LOURENCO;10319;F00741;PRESIDIO DE SÃO LOURENÇO
MG;3167103;SERRO;10348;F06061;PRESÍDIO DE SERRO I
MG;3167202;SETE LAGOAS;10451;F01013;PRESIDIO DE SETE LAGOAS
MG;3167202;SETE LAGOAS;10452;F04528;CENTRO SOCIOEDUCATIVO DE SETE LAGOAS
MG;3167202;SETE LAGOAS;10450;F01735;APAC SETE LAGOAS I
MG;3168002;TAIOBEIRAS;10353;F02420;PRESÍDIO  DE TAIOBEIRAS
MG;3168408;TARUMIRIM;10356;F02501;PRESÍDIO  DE TARUMIRIM
MG;3168606;TEOFILO OTONI;10411;F00723;PENITENCIARIA DE TEOFILO OTONI
MG;3168606;TEOFILO OTONI;10409;F01777;PRESIDIO DE TEOFILO OTONI
MG;3168606;TEOFILO OTONI;10408;F01991;APAC DE TEÓFILO OTONI I
MG;3168606;TEOFILO OTONI;10410;F02063;CENTRO SOCIOEDUCATIVO TEÓFILO OTONI  CSETO
MG;3168705;TIMOTEO;10335;F00721;PRESIDIO DE TIMOTEO
MG;3169307;TRES CORACOES;10365;F01278;PENITENCIARIA DE TRES CORACOES
MG;3169406;TRES PONTAS;10364;F01277;PRESIDIO DE TRES PONTAS
MG;3169604;TUPACIGUARA;10495;F07393;CENTRO SOCIOEDUCATIVO DE TUPACIGUARA
MG;3169604;TUPACIGUARA;10494;F00442;PRESÍDIO DE TUPACIGUARA I
MG;3169901;UBA;10412;F00471;PRESIDIO DE UBA
MG;3170107;UBERABA;10488;F01775;PENITENCIARIA DE UBERABA PROFESSOR ALUIZIO IGNACIO DE OLIVEIRA
MG;3170107;UBERABA;10489;F00775;CENTRO SOCIOEDUCATIVO  UBERABA  CSEUR
MG;3170206;UBERLANDIA;10492;F02018;PRESIDIO DE UBERLANDIA
MG;3170206;UBERLANDIA;10491;F04694;CENTRO SOCIOEDUCATIVO DE UBERLÂNDIA
MG;3111804;UBERLANDIA;10490;F04441;PENITENCIARIA DE UBERLÂNDIA I JOÃO PIMENTA DA VEIGA
MG;3170206;UBERLANDIA;10490;F04441;PENITENCIARIA DE UBERLÂNDIA I JOÃO PIMENTA DA VEIGA
MG;3170404;UNAI;10415;F01754;PENITENCIARIA AGOSTINHO DE OLIVEIRA JUNIOR
MG;3170404;UNAI;10413;F01819;CENTRO SOCIOEDUCATIVO DE UNAI
MG;3170404;UNAI;10414;F01306;PRESIDIO DE UNAI
MG;3170701;VARGINHA;10504;F04488;APAC DE VARGINHA
MG;3170800;VARZEA DA PALMA;10462;F02504;PRESIDIO DE VARZEA DE PALMA
MG;3171204;VESPASIANO;10434;F00184;PRESIDIO DE VESPASIANO I
MG;3171204;VESPASIANO;10435;F01544;CENTRO DE REFERENCIA A GESTANTE PRIVADA DE LIBERDADE
MG;3171303;VICOSA;10416;F00440;APAC DE VIÇOSA
MG;3172004;VISCONDE DO RIO BRANCO;10342;F04319;APAC VISCONDE DO RIO BRANCO I
MG;3172004;VISCONDE DO RIO BRANCO;10341;F00740;PRESIDIO DE VISCONDE DO RIO BRANCO
MS;5000609;AMAMBAI;10505;F00570;ESTABELECIMENTO PENAL DE AMAMBAI
MS;5001102;AQUIDAUANA;10507;F01121;ESTABELECIMENTO PENAL DE REGIME SEMIABERTO E AA DE AQUIDAUANA
MS;5001102;AQUIDAUANA;10506;F01118;ESTABELECIMENTO PENAL DE AQUIDAUANA
MS;5001904;BATAGUASSU;10509;F01592;ESTABELECIMENTO PENAL DE BATAGUASSU
MS;5002407;CAARAPO;10510;F03375;ESTABELECIMENTO PENAL MASCULINO DE REGIME FECHADO DE CAARAPÓ
MS;5002704;CAMPO GRANDE;10516;F00554;ESTABELECIMENTO PENAL FEMININO IRMÃ IRMA ZORZI
MS;5002704;CAMPO GRANDE;10513;F06701;PENITENCIÁRIA ESTADUAL MASCULINA DE REGIME FECHADO DA GAMELEIRA II
MS;5002704;CAMPO GRANDE;10520;F01117;CENTRO DE TRIAGEM ANIZIO LIMA
MS;5002704;CAMPO GRANDE;10514;F03502;PENITENCIÁRIA ESTADUAL MASCULINA DE REGIME FECHADO DA GAMELEIRA
MS;5002704;CAMPO GRANDE;10522;F01849;ESTABELECIMENTO PENAL FEMININO SEMIABERTOAAA CAMPO GRANDE
MS;5002704;CAMPO GRANDE;10517;F00658;UNIDADE EDUCACIONAL DE INTERNAÇÃO FEMININA ESTRELA DO AMANH
MS;5002704;CAMPO GRANDE;10518;F00815;PRESIDIO DE TRANSITO
MS;5002704;CAMPO GRANDE;10519;F00261;INSTITUTO PENAL DE CAMPO GRANDE
MS;5002704;CAMPO GRANDE;10521;F01128;ESTABELECIMENTO PENAL JAIR FERREIRA DE CARVALHO
MS;5002704;CAMPO GRANDE;10515;F00377;UNIDADE EDUCACIONAL DE INTERNAÇÃO MASCULINA DOM BOSCO
MS;5002704;CAMPO GRANDE;10523;F00549;PENITENCIÁRIA FEDERAL EM CAMPO GRANDEMS
MS;5002902;CASSILANDIA;10512;F04317;PATRONATO PENITENCIÁRIO DE CASSILÂNDIA
MS;5002902;CASSILANDIA;10511;F00277;ESTABELECIMENTO PENAL DE CASSILÂNDIA
MS;5003207;CORUMBA;10526;F00115;UNIDADE EDUCACIONAL DE INTERNAÇÃO MASCULINA PANTANAL
MS;5003207;CORUMBA;10524;F01859;ESTABELECIMENTO PENAL FEMININO DE CORUMBA
MS;5003207;CORUMBA;10525;F01871;ESTABELECIMENTO PENAL MASCULINO DE CORUMBA
MS;5003306;COXIM;10527;F00264;ESTABELECIMENTO PENAL MASCULINO DE COXIM
MS;5003488;DOIS IRMAOS DO BURITI;10508;F01113;PENITENCIÁRIA DE DOIS IRMÃOS DO BURITI
MS;5003702;DOURADOS;10531;F01851;PENITENCIÁRIA ESTADUAL DE DOURADOS
MS;5003702;DOURADOS;10529;F01916;UNIDADE EDUCACIONAL DE INTERNAÇÃO FEMININA ESPERANÇA
MS;5003702;DOURADOS;10528;F01095;ESTABELECIMENTO PENAL DE REGIME SEMIABERTO ABERTO E ASSISTÊNCIA AOS ALBERGADOS DE DOURADOS
MS;5003702;DOURADOS;10530;F00376;UNIDADE EDUCACIONAL DE INTERNAÇÃO MASCULINA LARANJA DOCE
MS;5004700;IVINHEMA;10532;F03376;ESTABELECIMENTO PENAL MASCULINO DE REGIME FECHADO DE IVINHEMA
MS;5005004;JARDIM;10533;F00262;ESTABELECIMENTO PENAL DE JARDIM MAXIMO ROMEIRO
MS;5005103;JATEI;10534;F04444;ESTABELECIMENTO PENAL FEMININO LUIZ PEREIRA DA SILVA
MS;5005707;NAVIRAI;10535;F01591;PENITENCIRIA DE SEGURANÇA MÁXIMA DE NAVIRAÍ
MS;5005707;NAVIRAI;10536;F06702;PATRONATO PENITENCIRIO DE NAVIRAI
MS;5006200;NOVA ANDRADINA;10537;F01858;ESTABELECIMENTO PENAL MASCULINO DE REGIME FECHADO DE NOVA ANDRADINA
MS;5006309;PARANAIBA;10539;F06866;PATRONATO PENITENCIRIO DE PARANAIBA
MS;5006309;PARANAIBA;10538;F01590;ESTABELECIMENTO PENAL DE PARANAIBA
MS;5006606;PONTA PORA;10542;F01360;UNIDADE PENAL RICARDO BRANDÃO
MS;5006606;PONTA PORA;10540;F00930;UNIDADE EDUCACIONAL DE INTERNAO MITAI
MS;5006606;PONTA PORA;10541;F00553;ESTABELECIMENTO PENAL FEMININO DE PONTA PORÃ
MS;5007208;RIO BRILHANTE;10544;F01602;ESTABELECIMENTO PENAL DE RIO BRILHANTE
MS;5007208;RIO BRILHANTE;10543;F00259;ESTABELECIMENTO PENAL FEMININO DE RIO BRILHANTE
MS;5007695;SAO GABRIEL DO OESTE;10545;F01115;ESTABELECIMENTO PENAL FEMININO DE SÃO GABRIEL DO OESTE
MS;5008305;TRES LAGOAS;10548;F00001;CENTRO PENAL INDUSTRIAL PARACELSO DE LIMA VIEIRA JESUS
MS;5008305;TRES LAGOAS;10546;F01369;ESTABELECIMENTO PENAL FEMININO DE TRÊS LAGOAS
MS;5008305;TRES LAGOAS;10547;F01603;PENITENCIARIA DE SEGURANÇA MÉDIA DE TRÊS LAGOAS
MS;5008305;TRES LAGOAS;10549;F01953;UNIDADE EDUCACIONAL DE INTERNAÇÃO MASCULINA TIA AURORA
MT;5100201;AGUA BOA;10551;F01422;PENITENCIÁRIA MAJOR PM ZUZIALVE DA SILVA
MT;5100300;ALTO ARAGUAIA;10550;F01416;CADEIA PÚBLICA DE ALTO ARAGUAIA
MT;5101258;ARAPUTANGA;10552;F01647;CADEIA PÚBLICA DE ARAPUTANGA
MT;5101308;ARENAPOLIS;10553;F00054;CADEIA PÚBLICA DE ARENÁPOLIS
MT;5101704;BARRA DO BUGRES;10556;F00868;CADEIA PÚBLICA DE BARRA DO BUGRES
MT;5101803;BARRA DO GARCAS;10554;F00315;CADEIA PÚBLICA DE BARRA DO GARÇAS
MT;5101803;BARRA DO GARCAS;10555;F00378;UNIDADE SOCIOEDUCATIVA DE BARRA DO GARÇAS
MT;5102504;CACERES;10559;F01166;CADEIA PÚBLICA DE CÁCERES FEMININA
MT;5102504;CACERES;10558;F00856;CADEIA PÚBLICA DE CÁCERES
MT;5102504;CACERES;10557;F00659;UNIDADE SOCIOEDUCATIVO DE CÁCERES
MT;5102637;CAMPO NOVO DO PARECIS;10572;F00066;CADEIA PUBLICA DE CAMPO NOVO DO PARECIS
MT;5103007;CHAPADA DOS GUIMARAES;10561;F01406;CADEIA PÚBLICA DE CHAPADA DOS GUIMARÃES
MT;5103205;COLIDER;10571;F01893;CADEIA PÚBLICA DE COLÍDER
MT;5103254;COLNIZA;10573;F00317;CADEIA PÚBLICA DE COLNIZA
MT;5103304;COMODORO;10560;F01417;CADEIA PÚBLICA DE COMODORO
MT;5103403;CUIABA;10569;F03681;COMPLEXO PENITENCIÁRIO AHMENON LEMON DANTAS
MT;5103403;CUIABA;10568;F00627;PENITENCIÁRIA FEMININA ANA MARIA DO COUTO MAY
MT;5103403;CUIABA;10563;F00614;UNIDADE PRISIONAL REGIONAL DE AGRÍCOLA DE PALMEIRAS
MT;5103403;CUIABA;10566;F03661;FUNDAÇÃO NOVA CHANCE
MT;5103403;CUIABA;10565;F08981;CENTRO DE ATENDIMENTO SOCIOEDUCATIVO DE INTERNAÇÃO FEMININA
MT;5103403;CUIABA;10564;F01464;CENTRO SOCIOEDUCATIVO DE CUIABÁ
MT;5103403;CUIABA;10562;F01151;CENTRO DE RESSOCIALIZAO DE CUIABA
MT;5103403;CUIABA;10567;F01892;PENITENCIÁRIA CENTRAL DO ESTADO
MT;5103502;DIAMANTINO;10574;F00854;CADEIA PÚBLICA DE DIAMANTINO
MT;5104807;JACIARA;10575;F00052;CADEIA PUBLICA DE JACIARA
MT;5105101;JUARA;10577;F00063;CADEIA PUBLICA DE JUARA
MT;5105150;JUINA;10576;F01161;CADEIA PÚBLICA DE JUÍNA
MT;5105259;LUCAS DO RIO VERDE;10578;F00316;CADEIA PÚBLICA DE LUCAS DO RIO VERDE
MT;5105622;MIRASSOL D OESTE;10579;F01153;CADEIA PÚBLICA DE MIRASSOL DOESTE
MT;5105903;NOBRES;10580;F00858;CADEIA PÚBLICA DE NOBRES
MT;5106000;NORTELANDIA;10581;F01414;CADEIA PÚBLICA DE NORTELÂNDIA
MT;5106257;NOVA XAVANTINA;10582;F00321;CADEIA PÚBLICA DE NOVA XAVANTINA
MT;5106307;PARANATINGA;10584;F00859;CADEIA PÚBLICA DE PARANATINGA
MT;5106422;PEIXOTO DE AZEVEDO;10588;F00871;CADEIA PÚBLICA DE PEIXOTO DE AZEVEDO
MT;5106752;PONTES E LACERDA;10586;F02499;CENTRO DE DETENÇÃO PROVISÓRIA PONTES E LACERDA
MT;5106778;PORTO ALEGRE DO NORTE;10583;F01162;CADEIA PUBLICA DE PORTO ALEGRE DO NORTE
MT;5106802;PORTO DOS GAUCHOS;10585;F00626;CADEIA PÚBLICA DE PORTO DOS GAÚCHOS
MT;5107040;PRIMAVERA DO LESTE;10587;F00620;CADEIA PÚBLICA DE PRIMAVERA DO LESTE
MT;5107602;RONDONOPOLIS;10589;F00067;CADEIA PBLICA FEMININA DE RONDONPOLIS
MT;5107602;RONDONOPOLIS;10590;F00628;MAJOR ELDO SÁ CORREA  MATA GRANDE
MT;5107859;SAO FELIX DO ARAGUAIA;10591;F01905;CADEIA PÚBLICA DE SÃO FÉLIX DO ARAGUAIA
MT;5107909;SINOP;10593;F01890;DR OSVALDO FLORENTINO LEITE FERREIRA
MT;5107909;SINOP;10592;F00931;CENTRO SOCIOEDUCATIVO DE SINOPMT
MT;5107925;SORRISO;10594;F00305;CADEIA PÚBLICA DE SORRISO
MT;5107958;TANGARA DA SERRA;10595;F00050;CENTRO DE DETENÇÂO PROVISÓRIA DE TANGARÁ DA SERRA
MT;5108402;VARZEA GRANDE;10570;F00613;CADEIA PUBLICA DE VARZEA GRANDE
PA;1500107;ABAETETUBA;10596;F01474;CENTRO DE RECUPERAÇÃO REGIONAL DE ABAETETUBA
PA;1500800;ANANINDEUA;10607;F00774;CENTRO SOCIOEDUCATIVO  FEMININO  CESEF
PA;1500800;ANANINDEUA;10606;F01572;UASE   I  CJM UNIDADE DE ATENDIMENTO SOCIOEDUCATIVO DE ANANINDEUA
PA;1500800;ANANINDEUA;10602;F01725;CENTRO DE REEDUCAÇÃO FEMININO
PA;1500800;ANANINDEUA;10604;F00226;UASE III  UNIDADE DE ATENDIMENTO SOCIOEDUCATIVO DE ANANINDEUA
PA;1500800;ANANINDEUA;10603;F01473;CENTRAL DE TRIAGEM METROPOLITANA II
PA;1500800;ANANINDEUA;10608;F02497;CENTRO DE ATENDIMENTO EM SEMILIBERDADE FEMININO  CASF
PA;1500800;ANANINDEUA;10605;F00225;UASE II  UNIDADE DE ATENDIMENTO SOCIOEDUCATIVO DE ANANIDNEUA
PA;1500800;ANANINDEUA;10609;F00972;CENTRAL DE TRIAGEM DA CIDADE NOVA
PA;1501402;BELEM;10610;F00976;CENTRAL DE TRIAGEM DA CREMAÇÃO
PA;1501402;BELEM;10611;F05162;CENTRAL INTEGRADA DE MONITORAMENTO ELETRONICO
PA;1501402;BELEM;10612;F01712;ASSOCIAÇÃO POLO PRODUTIVO DO PARÁ  FÁBRICA ESPERANÇA
PA;1501402;BELEM;10618;F01335;CENTRO DE ATENDIMENTO SOCIEDUCATIVO  CAS II
PA;1501402;BELEM;10617;F05161;CENTRO DE RECUPERAÇÃO DE CONDENADOS DE ICOARACI
PA;1501402;BELEM;10616;F02527;CENTRO DE ADOLESCENTE EM SEMILIBERDADE  CAS I
PA;1501402;BELEM;10615;F01986;CENTRO DE RECUPERAÇÃO DO COQUEIRO
PA;1501402;BELEM;10614;F02058;CENTRO SOCIOEDUCATIVO MASCULINO  CSEM
PA;1501402;BELEM;10613;F01237;CENTRO DE PROGRESSÃO PENITENCIÁRIO DE BELÉM
PA;1501402;BELEM;10619;F00695;CENTRO DE RECUPERAÇÃO REGIONAL DO MOSQUEIRO
PA;1501501;BENEVIDES;10620;F00773;UNIDADE SOCIOEDUCATIVA DE BENEVIDES
PA;1501709;BRAGANCA;10597;F01245;CENTRO DE RECUPERAÇÃO REGIONAL DE BRAGANÇA
PA;1501808;BREVES;10598;F02223;UNIDADE PRISIONAL CENTRO DE RECUPERAÇÃO REGIONAL DE BREVES  CRRBREVES
PA;1502103;CAMETA;10599;F00418;CENTRO DE RECUPERAÇÃO REGIONAL DE CAMETÁ
PA;1502202;CAPANEMA;10600;F00950;CENTRO DE RECUPERAÇÃO REGIONAL DE CAPANEMA
PA;1502400;CASTANHAL;10601;F01488;CENTRO DE RECUPERAÇÃO REGIONAL DE CASTANHAL
PA;1503606;ITAITUBA;10649;F00979;CENTRO DE RECUPERAÇÃO REGIONAL DE ITAITUBA
PA;1504208;MARABA;10640;F05130;UNIDADE SEMIABERTO MASCULINO DE MARABA
PA;1504208;MARABA;10641;F00949;CENTRO DE RECUPERAÇÃO FEMININO DE MARABÁ
PA;1504208;MARABA;10638;F03004;CIAMMARABÁCENTRO DE INTERNAÇÃO MASCULINA  MARABÁ
PA;1504208;MARABA;10639;F05103;CADEIA PUBLICA DE MARABA
PA;1504208;MARABA;10642;F00948;CENTRAL DE TRIAGEM MASCULINA DE MARABÁ
PA;1504422;MARITUBA;10622;F00970;PRESÍDIO ESTADUAL METROPOLITANO I
PA;1504422;MARITUBA;10623;F01492;PRESÍDIO ESTADUAL METROPOLITANO III
PA;1504422;MARITUBA;10621;F00135;PRESÍDIO ESTADUAL METROPOLITANO II
PA;1504604;MOCAJUBA;10624;F01239;CENTRO DE RECUPERAÇÃO REGIONAL DE MOCAJUBA
PA;1505502;PARAGOMINAS;10625;F00136;CENTRO DE RECUPERAÇÃO REGIONAL DE PARAGOMINAS
PA;1505536;PARAUAPEBAS;10643;F02540;CARCERAGEM DE PARAUAPEBAS
PA;1506138;REDENCAO;10644;F00420;CADEIA PUBLICA DE REDENÇÃO
PA;1506203;SALINOPOLIS;10626;F00138;CENTRO DE RECUPERAÇÃO REGIONAL DE SALINÓPOLIS
PA;1506500;SANTA IZABEL DO PARA;10631;F01732;HOSPITAL GERAL PENITENCIÁRIO
PA;1506500;SANTA IZABEL DO PARA;10628;F00667;CENTRO DE RECUPERAÇÃO PENITENCIÁRIA DO PARÁ III
PA;1506500;SANTA IZABEL DO PARA;10633;F02561;CENTRAL DE TRIAGEM METROPOLITANA IV
PA;1506500;SANTA IZABEL DO PARA;10634;F03361;CADEIA PÚBLICA PARA JOVENS E ADULTOS
PA;1506500;SANTA IZABEL DO PARA;10636;F03606;CENTRO DE RECUPERACÃO PENITENCIARIO DO PARÁ IV
PA;1506500;SANTA IZABEL DO PARA;10632;F01987;CENTRO DE RECUPERAÇÃO ESPECIAL CORONEL ANASTÁCIO DAS NEVES
PA;1506500;SANTA IZABEL DO PARA;10635;F03607;CENTRO DE RECUPERACÃO PENITENCIARIO DO PARÁ V
PA;1506500;SANTA IZABEL DO PARA;10629;F01248;COLÔNIA PENAL AGRÍCOLA DE SANTA ISABEL  CPASI
PA;1506500;SANTA IZABEL DO PARA;10630;F01475;CENTRAL DE TRIAGEM METROPOLITANA III
PA;1506500;SANTA IZABEL DO PARA;10627;F00149;CENTRO DE RECUPERAÇÃO PENITENCIÁRIO DO PARÁ II
PA;1506807;SANTAREM;10650;F01981;CENTRAL DE TRIAGEM MASCULINA DE SANTARÉM
PA;1506807;SANTAREM;10654;F01980;CENTRO DE RECUPERAÇÃO SILVIO HALL DE MOURA
PA;1506807;SANTAREM;10653;F03362;CENTRO DE RECUPERAÇÃO FEMININO DE SANTARÉM
PA;1506807;SANTAREM;10652;F01336;CSEBA SANTARÉM
PA;1506807;SANTAREM;10651;F02509;CENTRO   DE SEMILIBERDADE SANTAREM  CSS
PA;1507300;SAO FELIX DO XINGU;10645;F08904;CENTRO DE RECUPERAÇÃO DE SÃO FELIX DO XINGU
PA;1508001;TOME-ACU;10637;F01487;CENTRO DE RECUPERAÇÃO REGIONAL DE TOMÉAÇÚ
PA;1508100;TUCURUI;10647;F05123;UNIDADE PRISIONAL MASCULINA DE TUCURUI
PA;1508100;TUCURUI;10646;F01982;CENTRO DE RECUPERAÇÃO REGIONAL DE TUCURUÍ
PA;1508357;VITORIA DO XINGU;10648;F03608;CENTRO DE RECUPERAÇÃO MASCULINO DE VITORIA DO XINGU
PB;2500304;ALAGOA GRANDE;10679;F00040;CADEIA PÚBLICA DE ALAGOA GRANDE  OFICIAL
PB;2500403;ALAGOA NOVA;10708;F01398;CADEIA PÚBLICA DE ALAGOA NOVA
PB;2500502;ALAGOINHA;10680;F01372;CADEIA PÚBLICA DE ALAGOINHA
PB;2500601;ALHANDRA;10659;F00852;CADEIA PÚBLICA DE ALHANDRA
PB;2501005;ARARUNA;10681;F00605;CADEIA PÚBLICA DE ARARUNA
PB;2501104;AREIA;10709;F01634;CADEIA PÚBLICA DE AREIA
PB;2501302;AROEIRAS;10710;F02548;CADEIA PÚBLICA DE AROEIRAS
PB;2501500;BANANEIRAS;10682;F01404;CADEIA PÚBLICA DE BANANEIRAS
PB;2501807;BAYEUX;10660;F01889;CADEIA PÚBLICA DE BAYEUX  OFICIAL
PB;2501906;BELEM;10683;F00851;CADEIA PÚBLICA DE BELÉM
PB;2503704;CAJAZEIRAS;10696;F01887;PENITENCIÁRIA PADRÃO REGIONAL DE CAZAJEIRAS  OFICIAL
PB;2504009;CAMPINA GRANDE;10713;F00846;PENITENCIÁRIA FEMININA DE CAMPINA GRANDE  OFICIAL
PB;2504009;CAMPINA GRANDE;10712;F00042;PENITENCIÁRIA REGIONAL DE CAMPINA GRANDE RAIMUNDO ASFORA  OFICIAL
PB;2504009;CAMPINA GRANDE;10714;F01630;PENITENCIÁRIA PADRÃO REGIONAL DE CAMPINA GRANDE  OFICIAL
PB;2504009;CAMPINA GRANDE;10711;F01405;PENITENCIARIA DE CAMPINA GRANDE JURISTA AGNELLO AMORIMMONTE SANTO
PB;2504306;CATOLE DO ROCHA;10657;F01399;PRESIDIO DE CATOLE DO ROCHA  OFICIAL 1
PB;2504405;CONCEICAO;10686;F01632;CADEIA PÚBLICA DE CONCEIÇÃO
PB;2504801;COREMAS;10697;F01609;CADEIA PÚBLICA DE COREMAS
PB;2504900;CRUZ DO ESPIRITO SANTO;10677;F01374;CADEIA PÚBLICA DE CRUZ DO ESPÍRITO SANTO
PB;2505006;CUBATI;10658;F04526;CADEIA PÚBLICA DE CUBATI
PB;2505105;CUITE;10678;F01373;CADEIA PÚBLICA DE CUITÉ
PB;2506004;ESPERANCA;10715;F01401;CADEIA PÚBLICA DE ESPERANÇA
PB;2506301;GUARABIRA;10684;F00850;PENITENCIÁRIA JOÃO BOSCO CARNEIRO  OFICIAL
PB;2506806;INGA;10716;F00281;CADEIA PÚBLICA DE INGÁ
PB;2506905;ITABAIANA;10717;F01633;CADEIA PÚBLICA DE ITABAIANA
PB;2507002;ITAPORANGA;10687;F00047;CADEIA PÚBLICA DE ITAPORANGA
PB;2507309;JACARAU;10690;F00296;CADEIA PÚBLICA DE JACARAÚ
PB;2507507;JOAO PESSOA;10671;F01886;CENTRO DE REEDUCAÇÃO FEMININA MARIA JULIA MARANHÃO  OFICIAL
PB;2507507;JOAO PESSOA;10664;F01165;CENTRO SOCIOEDUCATIVO RITA GADELHA
PB;2507507;JOAO PESSOA;10662;F03541;GERÊNCIA EXECUTIVA DE RESSOCIALIZAÇÃO
PB;2507507;JOAO PESSOA;10668;F02512;CENTRO EDUCACIONAL AO ADOLESCENTE   CEA
PB;2507507;JOAO PESSOA;10665;F01629;PENITENCIARIA MODELO DESEMBARGADOR FLÓSCOLO DA NÓBREGA  ROGER  OFICIAL
PB;2507507;JOAO PESSOA;10670;F01144;PENITENCIÁRIA DESEMBARGADOR SILVIO PORTO  OFICIAL
PB;2507507;JOAO PESSOA;10663;F03323;UNIDADE DE SEMI LIBERDADE DA PARAIBA
PB;2507507;JOAO PESSOA;10672;F01628;PENITENCIÁRIA DE SEGURANÇA MÁXIMA CRIMINALISTA GERALDO BELTRÃO  OFICIAL
PB;2507507;JOAO PESSOA;10667;F01651;CENTRO EDUCACIONAL DO JOVEMCEJ
PB;2507507;JOAO PESSOA;10669;F00297;PENITENCIÁRIA DE SEGURANÇA MÉDIA JUIZ HITLER CANTALICE  OFICIAL
PB;2507507;JOAO PESSOA;10661;F01400;PENITENCIÁRIA DR ROMEU GONCALVES ABRANTES  PBI  PBII
PB;2507507;JOAO PESSOA;10673;F01908;CENTRO SOCIOEDUCATIVO  EDSON MOTACSE
PB;2507507;JOAO PESSOA;10666;F00848;PENITENCIRIA DE PSIQUIATRIA FORENSE DA PARAIBA
PB;2507705;JUAZEIRINHO;10718;F01631;CADEIA PÚBLICA DE JUAZEIRINHO
PB;2508307;LAGOA SECA;10719;F00326;COMPLEXO  LAR DO GAROTO PADRE OTÁVIO SANTOS
PB;2508802;MALTA;10689;F01884;CADEIA PÚBLICA DE MALTA
PB;2508901;MAMANGUAPE;10691;F00049;CADEIA PÚBLICA DE MAMANGUAPE
PB;2509701;MONTEIRO;10692;F00301;CADEIA PÚBLICA DE MONTEIRO
PB;2510808;PATOS;10699;F00300;PENITENCIARIA REGIONAL DE PATOS JURISTA ROMERO NOBREGA
PB;2510808;PATOS;10698;F01888;PENITENCIÁRIA REGIONAL DE PATOS  OFICIAL
PB;2511202;PEDRAS DE FOGO;10674;F00818;CADEIA PÚBLICA DE PEDRAS DE FOGO
PB;2511301;PIANCO;10688;F00576;CADEIA PÚBLICA DE PIANCÓ
PB;2511509;PILAR;10695;F00602;CADEIA PÚBLICA DE PILAR
PB;2512101;POMBAL;10707;F01862;CADEIA PÚBLICA DE POMBAL
PB;2512309;PRINCESA ISABEL;10704;F00045;CADEIA PÚBLICA DE PRINCESA ISABEL
PB;2512507;QUEIMADAS;10720;F00039;CADEIA PÚBLICA DE QUEIMADAS
PB;2512705;REMIGIO;10721;F01402;CADEIA PÚBLICA DE REMÍGIO
PB;2513406;SANTA LUZIA;10700;F01885;CADEIA PÚBLICA DE SANTA LUZIA
PB;2513703;SANTA RITA;10675;F00298;PENITENCIÁRIA PADRÃO DE SANTA RITA  OFICIAL
PB;2514008;SAO JOAO DO CARIRI;10706;F00610;CENTRO DE REEDUCAÇÃO ESPECIAL DES FRANCISCO ESPÍNOLA
PB;2514008;SAO JOAO DO CARIRI;10705;F00611;CADEIA PÚBLICA DE SÃO JOÃO DO CARIRI
PB;2500700;SAO JOAO DO RIO DO PEIXE;10655;F01146;CADEIA PÚBLICA DE SÃO JOÃO DO RIO DO PEIXE
PB;2514503;SAO JOSE DE PIRANHAS;10656;F00843;CADEIA PÚBLICA DE SÃO JOSÉ DE PIRANHAS
PB;2515302;SAPE;10676;F00607;PRESÍDIO REGIONAL DE SAPÉ  OFICIAL
PB;2515500;SERRA BRANCA;10693;F00608;CADEIA PÚBLICA DE SERRA BRANCA
PB;2516003;SOLANEA;10685;F02361;CADEIA PÚBLICA DE SOLÂNEA
PB;2516102;SOLEDADE;10722;F01635;CADEIA PÚBLICA DE SOLEDADE
PB;2516201;SOUSA;10701;F00847;COLÔNIA PENAL AGRÍCOLA DE SOUSA  OFICIAL
PB;2516201;SOUSA;10702;F01909;CENTRO EDUCACIONAL DO ADOLESCENTECEA SOUSA
PB;2516706;TEIXEIRA;10703;F01636;CADEIA PÚBLICA DE TEIXEIRA
PB;2516904;UIRAUNA;10694;F01122;CADEIA PÚBLICA DE UIRAÚNA
PB;2517001;UMBUZEIRO;10723;F00014;CADEIA PÚBLICA DE UMBUZEIRO
PE;2600054;ABREU E LIMA;10743;F03422;CENTRO DE REEDUCAÇÃO DA POLÍCIA MILITAR
PE;2600054;ABREU E LIMA;10741;F01163;PENITENCIARIA FEMENINA DE ABREU E LIMA
PE;2600054;ABREU E LIMA;10742;F00577;HOSPITAL DE CUSTÓDIA E TRATAMENTO PSIQUIATRÍCO
