SG_UF_PROVA;CO_MUNICIPIO_PROVA;NO_MUNICIPIO_PROVA;CO_COORDENACAO;CO_LOCAL;NO_LOCAL_PROVA
AC;1200203;CRUZEIRO DO SUL;10025;F05082;CENTRO SOCIOEDUCATIVO JURUA
AC;1200203;CRUZEIRO DO SUL;10024;F00806;UNIDADE PENITENCIÁRIA MANOEL NERI DA SILVA
AC;1200302;FEIJO;10026;F00944;CENTRO SOCIOEDUCATIVO FEIJÓ
AC;1200401;RIO BRANCO;10016;F00268;UNIDADE DE REGIME FECHADO N 3 DE RIO BRANCO
AC;1200401;RIO BRANCO;10018;F00266;UNIDADE DE REGIME SEMIABERTO N 1 DE RIO BRANCO
AC;1200401;RIO BRANCO;10021;F01594;UNIDADE DE REGIME FECHADO N 2 DE RIO BRANCO
AC;1200401;RIO BRANCO;10020;F01593;UNIDADE DE REGIME FECHADO FEMININO DE RIO BRANCO
AC;1200401;RIO BRANCO;10017;F00945;CENTRO SOCIOEDUCATIVO MOCINHA MAGALHAES
AC;1200401;RIO BRANCO;10013;F01709;CENTRO SOCIOEDUCATIVO SANTA JULIANA
AC;1200401;RIO BRANCO;10014;F00943;CENTRO SOCIOEDUCATIVO ACRE
AC;1200401;RIO BRANCO;10022;F02205;UNIDADE DE REGIME FECHADO  DE RIO BRANCO
AC;1200401;RIO BRANCO;10019;F01364;UNIDADE DE REGIME FECHADO N 1 DE RIO BRANCO
AC;1200401;RIO BRANCO;10015;F01959;CENTRO SOCIOEDUCATIVO AQUIRY
AC;1200500;SENA MADUREIRA;10027;F01101;UNIDADE PENITENCIÁRIA EVARISTO DE MORAES
AC;1200450;SENADOR GUIOMARD;10023;F00560;UNIDADE PENITENCIÁRIA QUINARI
AC;1200609;TARAUACA;10028;F00807;UNIDADE PENITENCIÁRIA MOACIR PRADO
AC;1200609;TARAUACA;10029;F07672;UNIDADE PENITENCIÁRIA FEMININA DE TARAUACÁ
AL;2702900;GIRAU DO PONCIANO;10030;F00615;UNIDADE PRISIONAL DO AGRESTE
AL;2704302;MACEIO;10033;F04625;PRESÍDIO BALDOMERO CAVALCANTI DE OLIVEIRA
AL;2704302;MACEIO;10043;F02524;UNIDADE DE INTERNAÇÃO MASCULINA DE JOVENS E ADULTOS 3
AL;2704302;MACEIO;10031;F01704;UNIDADE DE SEMILIBERDADE MASCULINA
AL;2704302;MACEIO;10041;F01895;CENTRO PSIQUIATRICO JUDICIARIO PEDRO MARINHO SURUAGY  CPJ
AL;2704302;MACEIO;10035;F00307;ESTABELECIMENTO PRISIONAL RUBENS BRAGA QUINTELLA CAVALCANTI  NRC
AL;2704302;MACEIO;10042;F02469;PENITENCIÁRIA DE SEGURANÇA MÁXIMA
AL;2704302;MACEIO;10039;F00118;UNIDADE DE INTERNAÇÃO MASCULINA
AL;2704302;MACEIO;10034;F04626;PRESÍDIO FEMININO SANTA LUZIA
AL;2704302;MACEIO;10045;F02477;UNIDADE DE INTERNAÇÃO MASCULINA DE JOVENS E ADULTOS 2
AL;2704302;MACEIO;10040;F00937;UNIDADE DE INTERNAÇÃO MASCULINA EXTENSÃO
AL;2704302;MACEIO;10032;F00938;UNIDADE DE INTERNAÇÃO MASCULINA EXTENSÃO II
AL;2704302;MACEIO;10036;F07761;PRESIDIO CYRIDIÃO DURVAL E SILVA
AL;2704302;MACEIO;10044;F02476;UNIDADE DE INTERNAÇÃO MASCULINA EXTENSÃO 3
AL;2704302;MACEIO;10037;F07827;COLONIA AGROINDUSTRIAL SAO LEONARDO  SEMI ABERTO
AL;2704302;MACEIO;10038;F01955;UNIDADE DE INTERNAÇÃO JOVENS E ADULTOS UIJA
AL;2707701;RIO LARGO;10046;F02523;UNIDADE DE INTERNAÇÃO PROVISÓRIA  MASCULINA RIO LARGO
AM;1301209;COARI;10047;F01459;UNIDADE PRISIONAL DE COARI
AM;1301704;HUMAITA;10061;F00370;UNIDADE PRISIONAL DE HUMAITA
AM;1301902;ITACOATIARA;10048;F01207;UNIDADE PRISIONAL DE ITACOATIARA
AM;1302603;MANAUS;10056;F00654;INSTITUTO PENAL ANTÔNIO TRINDADE
AM;1302603;MANAUS;10049;F01208;CENTRO DE DETENÇÃO PROVISÓRIA DE MANAUS I
AM;1302603;MANAUS;10055;F01334;CENTRO SOCIOEDUCATIVO DAGMAR FEITOZA
AM;1302603;MANAUS;10053;F03021;ENFERMARIA PSIQUIÁTRICA CPDM I
AM;1302603;MANAUS;10052;F03003;CENTRO DE DETENÇÃO PROVISÓRIA DE MANAUS II
AM;1302603;MANAUS;10050;F00373;UNIDADE PRISIONAL DO PURAQUEQUARA
AM;1302603;MANAUS;10051;F01695;COMPLEXO PENITENCIARIO ANISIO JOBIM  REGIME FECHADO
AM;1302603;MANAUS;10054;F07302;CENTRO DE DETENÇÃO FEMININA  CDF
AM;1302900;MAUES;10057;F00923;UNIDADE PRISIONAL DE MAUES
AM;1303403;PARINTINS;10058;F00111;UNIDADE PRISIONAL DE PARINTINS
AM;1304062;TABATINGA;10059;F01209;UNIDADE PRISIONAL DE TABATINGA
AM;1304203;TEFE;10060;F00369;UNIDADE PRISIONAL DE TEFE
AP;1600303;MACAPA;10064;F00389;TRATAMENTO PENAL DO ESTADO DO AMAPÁ
AP;1600303;MACAPA;10067;F00947;PENITENCIÁRIA MASCULINA DO ESTADO DO AMAPÁ PARA PRESOS EM REGIME FECHADO
AP;1600303;MACAPA;10062;F00932;NUCLEO DE MEDIDA SOCIOEDUCATIVA DE INTERNAÇÃO MASCULINA  CESEIM
AP;1600303;MACAPA;10066;F00946;COLÔNIA PENAL DO ESTADO DO AMAPÁ PARA PRESOS EM REGIME SEMIABERTO
AP;1600303;MACAPA;10065;F00126;CENTRO DE CUSTÓDIA DO ESTADO DO AMAPÁ   PARA PRESOS PROVISÓRIOS
AP;1600303;MACAPA;10063;F02496;NÚCLEO DE MEDIDA SOCIOEDUCATIVA DE INTERNAÇÃO FEMININA  CIFEM
AP;1600303;MACAPA;10068;F01960;PENITENCIÁRIA FEMININA DO ESTADO DO AMAPÁ
BA;2903201;BARREIRAS;10069;F02944;CONJUNTO PENAL DE BARREIRAS
BA;2905701;CAMACARI;10070;F01942;CASE IRMÃ DULCE  COMUNIDADE DE ATENDIMENTO SOCIOEDUCATIVO
BA;2910727;EUNAPOLIS;10072;F00866;CONJUNTO PENAL DE EUNÁPOLIS
BA;2910800;FEIRA DE SANTANA;10075;F01410;CONJUNTO PENAL DE FEIRA DE SANTANA
BA;2910800;FEIRA DE SANTANA;10074;F01472;CASE MELLO MATTOS  COMUNIDADE DE ATENDIMENTO SOCIOEDUCATIVO
BA;2910800;FEIRA DE SANTANA;10073;F00119;CASE ZILDA ARNS  COMUNIDADE DE ATENDIMENTO SOCIOEDUCATIVO
BA;2913606;ILHEUS;10076;F00313;PRESÍDIO ADVOGADO ARISTON CARDOSO
BA;2914802;ITABUNA;10077;F00060;CONJUNTO PENAL DE ITABUNA
BA;2918001;JEQUIE;10078;F01899;CONJUNTO PENAL DE JEQUIÉ
BA;2918407;JUAZEIRO;10079;F01411;CONJUNTO PENAL DE JUAZEIRO
BA;2919207;LAURO DE FREITAS;10080;F01640;CONJUNTO PENAL DE LAURO DE FREITAS
BA;2924009;PAULO AFONSO;10081;F04437;CONJUNTO PENAL DE PAULO AFONSOBA
BA;2927408;SALVADOR;10088;F02942;CONJUNTO PENAL MASCULINO DE SALVADOR
BA;2927408;SALVADOR;10084;F00061;CASA DO ALBERGADO E EGRESSOS
BA;2927408;SALVADOR;10082;F00380;CASE SALVADOR  COMUNIDADE DE ATENDIMENTO SOCIOEDUCATIVO
BA;2927408;SALVADOR;10087;F01157;CONJUNTO PENAL FEMININO
BA;2927408;SALVADOR;10090;F00379;CASE CIA  COMUNIDADE DE ATENDIMENTO SOCIOEDUCATIVO
BA;2927408;SALVADOR;10092;F00862;HOSPITAL DE CUSTÓDIA E TRATAMENTO
BA;2927408;SALVADOR;10086;F00865;PENITENCIÁRIA LEMOS BRITO
BA;2927408;SALVADOR;10091;F01898;PRESIDIO SALVADOR
BA;2927408;SALVADOR;10083;F00101;CASE FEMININA  COMUNIDADE DE ATENDIMENTO SOCIOEDUCATIVO
BA;2927408;SALVADOR;10085;F00312;CADEIA PUBLICA DE SALVADOR
BA;2927408;SALVADOR;10089;F00309;COLONIA LAFAYETE COUTINHO
BA;2930501;SERRINHA;10093;F00059;CONJUNTO PENAL DE SERRINHA
BA;2930709;SIMOES FILHO;10071;F01158;COLONIA PENAL DE SIMOES FILHO
BA;2931350;TEIXEIRA DE FREITAS;10094;F01409;CONJUNTO PENAL DE TEIXEIRA DE FREITAS
BA;2932903;VALENCA;10095;F01156;CONJUNTO PENAL DE VALENÇA
BA;2933307;VITORIA DA CONQUISTA;10098;F02124;CONJUNTO PENAL DE VITÓRIA DA CONQUISTA
BA;2933307;VITORIA DA CONQUISTA;10097;F01641;CONJUNTO PENAL ADVOGADO NILTON GONÇALVES
BA;2933307;VITORIA DA CONQUISTA;10096;F08311;CASE PROFESSOR WANDERLINO NOGUEIRA NETO
CE;2300309;ACOPIARA;10106;F00894;CADEIA PÚBLICA DE ACOPIARA
CE;2301000;AQUIRAZ;10109;F02226;UNIDADE PRISIONAL IRMÃ MARIA IMELDA LIMA PONTES
CE;2301000;AQUIRAZ;10110;F02984;CENTRO DE DETENÇÃO PROVISÓRIA
CE;2301000;AQUIRAZ;10108;F00887;INSTITUTO PENAL FEMININO DESA AURI MOURA COSTAIPF
CE;2301901;BARBALHA;10121;F02283;CADEIA PUBLICA DE JUAZEIRO DO NORTE  MASCULINA
CE;2303006;CARIDADE;10100;F00867;CADEIA PÚBLICA DE CARIDADE
CE;2303709;CAUCAIA;10107;F00360;CASA DE PRISÃO PROVISORIA DE LIBERDADE DESFOCO ADALBERTO OLIVEIRA BARROS LEAL
CE;2303808;CEDRO;10103;F00093;CADEIA PÚBLICA DE CEDRO
CE;2304202;CRATO;10122;F01435;UNIDADE PRISIONAL FEMININA DO CRATO
CE;2304459;FORTIM;10099;F01441;CADEIA PÚBLICA DE FORTIM
CE;2304707;GRANJA;10102;F00893;CADEIA PÚBLICA DE GRANJA
CE;2305407;ICO;10104;F00094;CADEIA PÚBLICA DE ICÓ
CE;2306256;ITAITINGA;10120;F04311;CASA DE PRIVAÇÃO PROVISÓRIA DE LIBERDADE  CPPL VI
CE;2306256;ITAITINGA;10112;F00633;CASA DE PRIVAÇÃO PROVISORIA DE LIBERDADECPPLII
CE;2306256;ITAITINGA;10117;F02526;CENTRO DE EXECUÇÃO PENAL E INTEGRAÇÃO SOCIAL VASCO DAMASCENO WEYNE
CE;2306256;ITAITINGA;10114;F00903;INSTITUTO PRESÍDIO PROFESSOR OLAVO OLIVEIRA II
CE;2306256;ITAITINGA;10119;F02983;UNIDADE PRISIONAL PROFESSOR JOSÉ SOBREIRA DE AMORIM
CE;2306256;ITAITINGA;10116;F01924;CASA DE PRIVAÇÃO PROVISÓRIA DE LIBERDADE AGENTE PENITENCIÁRIO ELIAS ALVES DA SILVA
CE;2306256;ITAITINGA;10115;F01429;CASA DE PRIVAÇÃO PROVISORIA DE LIBERDADECPPLIII
CE;2306256;ITAITINGA;10118;F02569;CENTRO DE TRIAGEM E OBSERVAÇÃO CRIMINOLÓGICA
CE;2306256;ITAITINGA;10111;F00631;CASA DE PRIVAÇÃO PROVISÓRIA DE LIBERDADE  AGENTE LUCIANO ANDRADE LIMA
CE;2306256;ITAITINGA;10113;F00896;INSTITUTO PSIQUIÁTRICO GOVERNADOR STÊNIO GOMES
CE;2307304;JUAZEIRO DO NORTE;10123;F01927;PENITENCIÁRIO INDUSTRIAL REGIONAL DO CARIRI
CE;2309409;NOVO ORIENTE;10101;F01936;CADEIA PÚBLICA DE NOVO ORIENTE
CE;2309706;PACATUBA;10124;F01922;PENITENCIÁRIA FRANCISCO HÉLIO VIANA DE ARAÚJO  PFHVA
CE;2312908;SOBRAL;10126;F00349;PENITENCIÁRIO INDUSTRIAL REGIONAL DE SOBRAL
CE;2312908;SOBRAL;10125;F00085;CADEIA PÚBLICA DE SOBRAL
CE;2313500;TRAIRI;10105;F00342;CADEIA PÚBLICA DE TRAIRÍ
DF;5300108;BRASILIA;10141;F00941;UNIDADE DE INTERNAÇÃO DE PLANALTINA
DF;5300108;BRASILIA;10134;F01363;CENTRO DE DETENÇÃO PROVISÓRIA CDPII
DF;5300108;BRASILIA;10139;F01217;UNIDADE DE INTERNAÇÃO DO RECANTO DAS EMASUNIRE
DF;5300108;BRASILIA;10127;F00942;UNIDADE DE INTERNAÇÃO DE SAÍDA SISTEMÁTICA UNISS
DF;5300108;BRASILIA;10132;F03186;PENITENCIARIA FEDERAL EM BRASILIADF
DF;5300108;BRASILIA;10137;F00124;UNIDADE DE INTERNAÇÃO DE SANTA MARIAUISM
DF;5300108;BRASILIA;10130;F00558;PENITENCIÁRIA DO DISTRITO FEDERAL II  PDFII
DF;5300108;BRASILIA;10128;F00559;CENTRO DE PROGRESSÃO PENITENCIÁRIA CPP
DF;5300108;BRASILIA;10129;F00003;CENTRO DE INTERNAMENTO E REEDUCAÇÃO  CIR
DF;5300108;BRASILIA;10133;F00125;UNIDADE DE INTERNAÇÃO DE SÃO SEBASTIÃO UISS
DF;5300108;BRASILIA;10135;F03512;UNIDADE DE INTERNAÇÃO FEMININA DO GAMA
DF;5300108;BRASILIA;10131;F01362;CENTRO DE DETENÇÃO PROVISORIA I   CDP I
DF;5300108;BRASILIA;10138;F00002;PENITENCIÁRIA DO DISTRITO FEDERAL I  PDFI
DF;5300108;BRASILIA;10140;F03511;UNIDADE DE INTERNATO DE BRAZILNDIA UIBRAS
DF;5300108;BRASILIA;10136;F01096;PENITENCIÁRIA FEMININA DO DISTRITO FEDERAL  PFDF
ES;3200607;ARACRUZ;10142;F00432;CENTRO DE DETENÇÃO PROVISÓRIA DE ARACRUZ CDPA
ES;3200904;BARRA DE SAO FRANCISCO;10143;F00172;PENITENCIÁRIA REGIONAL DE BARRA DE SÃO FRANCISCO
ES;3201209;CACHOEIRO DE ITAPEMIRIM;10156;F00652;UNIDADE DE INTERNAÇÃO REGIONAL SUL
ES;3201209;CACHOEIRO DE ITAPEMIRIM;10155;F01516;CENTRO PRISIONAL FEMININO DE CACHOEIRO DE ITAPEMIRIM
ES;3201209;CACHOEIRO DE ITAPEMIRIM;10157;F02510;CENTRO DE DETENÇÃO PROVISÓRIA DE CACHOEIRO DE ITAPEMIRIM  CDPCI
ES;3201209;CACHOEIRO DE ITAPEMIRIM;10158;F00714;PENITENCIÁRIA REGIONAL DE CACHOEIRO DE ITAPEMIRIM
ES;3201209;CACHOEIRO DE ITAPEMIRIM;10154;F00150;ASSOCIAÇÃO DE PROTEÇÃO E ASSISTÊNCIA AOS CONDENADOS
ES;3201308;CARIACICA;10146;F03421;ESPAÇO PEDAGÓGICO
ES;3201308;CARIACICA;10145;F01196;CENTRO SOCIOEDUCATIVO DE ATENDIMENTO AO ADOLESCENTE EM CONFLITO COM A LEI  CSE
ES;3201308;CARIACICA;10147;F01493;CENTRO PRISIONAL FEMININO DE CARIACICACPFC
ES;3201308;CARIACICA;10144;F01271;PENITENCIÁRIA SEMIABERTA DE CARIACICA
ES;3201506;COLATINA;10161;F02015;CENTRO PRISIONAL FEMININO DE COLATINA
ES;3201506;COLATINA;10159;F00434;PENITENCIÁRIA DE SEGURANÇA MÉDIA DE COLATINA
ES;3201506;COLATINA;10162;F00716;PENITENCIÁRIA SEMIABERTA MASCULINA DE COLATINA
ES;3201506;COLATINA;10160;F00464;CENTRO DE DETENÇÃO PROVISÓRIO DE COLATINA
ES;3202405;GUARAPARI;10163;F00171;CENTRO DE DETENÇÃO PROVISÓRIA DE GUARAPARI  CDPG
ES;3203205;LINHARES;10165;F01945;UNIDADE DE INTERNAÇÃO REGIONAL NORTE
ES;3203205;LINHARES;10164;F01693;UNIDADE DE INTERNAÇÃO PROVISORIA REGIONAL NORTE
ES;3203205;LINHARES;10167;F00173;PENITENCIÁRIA REGIONAL DE LINHARES
ES;3203205;LINHARES;10166;F00151;CENTRO DE RESSOCIALIZAÇÃO DE LINHARES
ES;3203320;MARATAIZES;10168;F01519;CENTRO DE DETENO PROVISÓRIA DE MARATAZES
ES;3204658;SAO DOMINGOS DO NORTE;10170;F00435;CDPSDN  CENTRO DE DETENÇÃO PROVISÓRIA DE SÃO DOMINGOS DO NORTEES
ES;3204906;SAO MATEUS;10174;F08223;PENITENCIÁRIA REGIONAL DE SÃO MATEUS
ES;3204906;SAO MATEUS;10171;F01249;CENTRO DE DETENÇÃO PROVISÓRIA DE SÃO MATEUS CDPSM
ES;3204906;SAO MATEUS;10173;F07702;PENITENCIÁRIA REGIONAL DE SÃO MATEUS
ES;3204906;SAO MATEUS;10172;F01517;PENITENCIÁRIA REGIONAL DE SÃO MATEUS
ES;3205002;SERRA;10169;F00465;CENTRO DE DETENÇÃO PROVISORIA DE SERRA
ES;3205101;VIANA;10149;F02014;PENITECIÁRIA DE SEGURANA MÉDIA I
ES;3205101;VIANA;10153;F01734;PENITENCIÁRIA DE SEGURANÇA MÁXIMA II
ES;3205101;VIANA;10150;F02016;PENITENCIÁRIA AGRÍCOLA DO ESPÍRITO SANTO
ES;3205101;VIANA;10151;F00715;PENITENCIÁRIA DE SEGURANÇA MÁXIMA I PSMA I
ES;3205101;VIANA;10148;F01515;CENTRO DE DETENÇÃO PROVISÓRIA DE VIANA II
ES;3205101;VIANA;10152;F00433;PENITENCIÁRIA DE SEGURANÇA MÉDIA II
ES;3205200;VILA VELHA;10181;F01010;PENITENCIARIA ESTADUAL DE VILA VELHA I PEVV I
ES;3205200;VILA VELHA;10183;F01751;CENTRO DE DETENÇÃO PROVISÓRIA DE VILHA VELHA
ES;3205200;VILA VELHA;10177;F01988;CASA DE CUSTÓDIA DE VILA VELHA
ES;3205200;VILA VELHA;10176;F01451;UNIDADE DE INTERNAÇÃO METROPOLITANA  UNIMETRO
ES;3205200;VILA VELHA;10178;F00431;PENITENCIÁRIA ESTADUAL DE VILA VELHA II
ES;3205200;VILA VELHA;10180;F00981;PENITENCIÁRIA ESTADUAL DE VILA VELHA III PEVV III
ES;3205200;VILA VELHA;10182;F01494;PENITENCIÁRIA ESTADUAL DE VILA VELHA V PEVV V
ES;3205200;VILA VELHA;10179;F00462;PENITENCIÁRIA SEMIABERTA DE VILA VELHA
ES;3205309;VITORIA;10175;F00463;PRESIDIO MILITAR DA PMES
GO;5200134;ACREUNA;10250;F01191;UNIDADE PRISIONAL DE ACREÚNA
GO;5200258;AGUAS LINDAS DE GOIAS;10184;F01448;UNIDADE REGIONAL PRISIONAL DE AGUAS LINDAS
GO;5200308;ALEXANIA;10194;F00645;UNIDADE PRISIONAL DE ALEXANIA
GO;5200605;ALTO PARAISO DE GOIAS;10195;F01174;UNIDADE PRISIONAL DE ALTO PARAÍSO
GO;5201108;ANAPOLIS;10213;F00075;UNIDADE PRISIONAL DE ANAPOLIS
GO;5201108;ANAPOLIS;10214;F00521;CENTRO DE ATENDIMENTO SOCIOEDUCATIVO   CASE ANÁPOLIS
GO;5201405;APARECIDA DE GOIANIA;10215;F01171;PENITENCIÁRIA FEMININA CONSUELO NASSER
GO;5201405;APARECIDA DE GOIANIA;10217;F01913;PENITENCIÁRIA CORONEL ODENIR GUIMARÃES
GO;5201405;APARECIDA DE GOIANIA;10216;F01176;CASA DE PRISÃO PROVISÓRIA DE APARECIDA DE GOIÂNIA
GO;5201603;ARACU;10237;F04307;UNIDADE PRISIONAL DE ARAÇU
GO;5201702;ARAGARCAS;10218;F01679;UNIDADE PRISIONAL DE ARAGARÇAS
GO;5203203;BARRO ALTO;10245;F02562;UNIDADE PRISIONAL DE BARRO ALTO
GO;5203302;BELA VISTA DE GOIAS;10219;F01658;UNIDADE PRISIONAL DE BELA VISTA
GO;5203609;BRAZABRANTES;10238;F02581;UNIDADE PRISIONAL DE ITAUÇU
GO;5204409;CAIAPONIA;10220;F05122;UNIDADE PRISIONAL REGIONAL DE CAIAPÔNIA
GO;5204508;CALDAS NOVAS;10221;F01914;UNIDADE PRISIONAL DE CALDAS NOVAS
GO;5204904;CAMPOS BELOS;10196;F00882;UNIDADE PRISIONAL DE CAMPOS BELOS
GO;5205109;CATALAO;10222;F01656;UNIDADE PRISIONAL DE CATALÃO
GO;5205406;CERES;10209;F03005;UNIDADE PRISIONAL DE CERES
GO;5205802;CORUMBA DE GOIAS;10197;F01910;UNIDADE PRISIONAL DE CORUMBA DE GOIAS
GO;5205901;CORUMBAIBA;10203;F04356;UNIDADE PRISIONAL REGIONAL FEMININA DE CORUMBAÍBA
GO;5206206;CRISTALINA;10198;F00880;UNIDADE PRISIONAL DE CRISTALINA
GO;5208004;FORMOSA;10185;F01333;CENTRO DE ATENDIMENTO SOCIOEDUCATIVO  CASE  FORMOSA
GO;5208400;GOIANAPOLIS;10223;F02564;UNIDADE PRISIONAL DE GOIANAPOLIS
GO;5208608;GOIANESIA;10224;F01173;UNIDADE PRISIONAL DE GOIANÉSIA
GO;5208707;GOIANIA;10225;F00223;CENTRO DE ATENDIMENTO SOCIOEDUCATIVO CASE  GOIÂNIA
GO;5208905;GOIAS;10240;F01680;UNIDADE PRISIONAL DE GOIÁS
GO;5208905;GOIAS;10239;F04328;UNIDADE PRISIONAL DE URUANA
GO;5209101;GOIATUBA;10236;F00076;UNIDADE PRISIONAL DE GOIATUBA
GO;5210000;INHUMAS;10226;F00646;UNIDADE PRISIONAL DE INHUMAS
GO;5210109;IPAMERI;10204;F00648;UNIDADE PRISIONAL DE IPAMERI
GO;5210208;IPORA;10200;F01941;UNIDADE PRISIONAL DE IPORA
GO;5210406;ITABERAI;10210;F00073;UNIDADE PRISIONAL DE ITABERAÍ
GO;5211206;ITAPURANGA;10211;F01192;UNIDADE PRISIONAL DE ITAPURANGA
GO;5211503;ITUMBIARA;10227;F00078;UNIDADE PRISIONAL DE ITUMBIARA
GO;5211800;JARAGUA;10228;F01167;UNIDADE PRISIONAL DE JARAGUA
GO;5211909;JATAI;10229;F01423;UNIDADE PRISIONAL DE JATAI
GO;5212204;JUSSARA;10241;F00630;UNIDADE PRISIONAL DE JUSSARA
GO;5212501;LUZIANIA;10186;F00221;CENTRO DE ATENDIMENTO SOCIOEDUCATIVO  CASE  LUZIÂNIA
GO;5212501;LUZIANIA;10187;F00329;CASA DE PRISÃO PROVISÓRIA DE LUZIÂNIA
GO;5212501;LUZIANIA;10188;F00336;PENITENCIARIA FEMININA DE LUZIANIA
GO;5212501;LUZIANIA;10189;F01940;UNIDADE PROSIONAL REGIONAL DE LUZIANIA
GO;5213087;MINACU;10251;F00649;UNIDADE PRISIONAL REGIONAL DE MINACU
GO;5213806;MORRINHOS;10230;F00629;UNIDADE PRISIONAL DE MORRINHOS
GO;5214606;NIQUELANDIA;10246;F00881;UNIDADE PRISIONAL DE NIQUELANDIA
GO;5215231;NOVO GAMA;10190;F00333;UNIDADE PRISIONAL DE NOVO GAMA
GO;5215306;ORIZONA;10205;F04388;UNIDADE PRISIONAL REGIONAL FEMININA DE ORIZONA
GO;5215603;PADRE BERNARDO;10191;F01655;UNIDADE PRISIONAL DE PADRE BERNARDO
GO;5215702;PALMEIRAS DE GOIAS;10201;F01193;UNIDADE PRISIONAL DE PALMEIRAS
GO;5216304;PARANAIGUARA;10242;F04327;UNIDADE PRISIONAL  REGIONAL FEMININA DE PARANAIGUARA
GO;5217104;PIRACANJUBA;10206;F00332;UNIDADE PRISIONAL REGIONAL DE PIRACANJUBA
GO;5217401;PIRES DO RIO;10207;F04399;UNIDADE PRISIONAL REGIONAL DE PIRES DO RIO
GO;5218003;PORANGATU;10248;F01175;UNIDADE PRISIONAL DE PORANGATU
GO;5218003;PORANGATU;10247;F00772;CENTRO DE ATENDIMENTO SOCIOEDUCATIVO  CASE PORANGATU
GO;5218607;RIALMA;10212;F00100;UNIDADE PRISIONAL DE RIALMA
GO;5218805;RIO VERDE;10232;F00878;CASA DE PRISÃO PROVISÓRIA DE RIO VERDE
GO;5218805;RIO VERDE;10231;F00337;UNIDADE PRISIONAL DE RIO VERDE
GO;5218904;RUBIATABA;10235;F02563;UNIDADE PRISIONAL DE RUBIATABA
GO;5219308;SANTA HELENA DE GOIAS;10243;F01911;UNIDADE PRISIONAL DE SANTA HELENA
GO;5219753;SANTO ANTONIO DO DESCOBERTO;10192;F00334;UNIDADE PRISIONAL DE SANTO ANTÔNIO DO DESCOBERTO
GO;5220108;SAO LUIS DE MONTES BELOS;10202;F01446;UNIDADE PRISIONAL DE SÃO LUIS DE MONTES BELOS
GO;5220454;SENADOR CANEDO;10233;F01449;CADEIA PUBLICA DE SENADOR CANEDO
GO;5220504;SERRANOPOLIS;10244;F02193;UNIDADE PRISIONAL DE SERRANÓPOLIS
GO;5220603;SILVANIA;10234;F03006;UNIDADE PRISIONAL DE SILVANIA
GO;5220686;SIMOLANDIA;10199;F01939;UNIDADE PRISIONAL REGIONAL DE SIMOLANDIA
GO;5221601;URUACU;10249;F01653;UNIDADE PRISIONAL DE URUACU
GO;5221858;VALPARAISO DE GOIAS;10193;F01172;UNIDADE PRISIONAL DE VALPARAÍSO
GO;5222005;VIANOPOLIS;10208;F04408;UNIDADE PRISIONAL DE VIANÓPOLIS
MA;2100055;ACAILANDIA;10252;F02172;UPR DE AÇAILÂNDIA
MA;2101202;BACABAL;10262;F03604;APAC BACABALCENTRO DE REINTEGRAÇÃO SOCIAL DR MÁRIO OTTOBONI
MA;2101202;BACABAL;10261;F02173;UPR DE BACABAL
MA;2101400;BALSAS;10253;F02324;UPR DE BALSAS
MA;2101608;BARRA DO CORDA;10263;F03371;UNIDADE PRISIONAL DE BARRA DO CORDA
MA;2102804;CAROLINA;10254;F03605;UNIDADE PRISIONAL DE CAROLINA
MA;2103000;CAXIAS;10269;F00036;UPR DE CAXIAS
MA;2103208;CHAPADINHA;10264;F01624;UPR DE CHAPADINHA
MA;2103307;CODO;10265;F02322;UPR DE CODÓ
MA;2103505;COLINAS;10266;F03082;UNIDADE PRISIONAL DE COLINAS
MA;2103604;COROATA;10267;F02228;UPR DE COROATÁ
MA;2103703;CURURUPU;10268;F02196;UPR DE CURURUPU
MA;2103752;DAVINOPOLIS;10255;F01882;UNIDADE PRISIONAL DE RESSOCIALIZAÇÃO DE DAVINOPOLIS
MA;2104305;GODOFREDO VIANA;10281;F05781;UNIDADE PRISIONAL DE RESSOCIALIZAÇÃO DE GODOFREDO VIANA
MA;2104677;GOVERNADOR NUNES FREIRE;10270;F03089;UNIDADE PRISIONAL DE GOV NUNES FREIRE
MA;2104800;GRAJAU;10271;F02542;UPR DE GRAJAÚ
MA;2105302;IMPERATRIZ;10256;F03508;CENTRO SOCIOEDUCATIVO DE INTERNAÇÃO SEMEAR
MA;2105302;IMPERATRIZ;10259;F02529;PENITENCIÁRIA REGIONAL DE IMPERATRIZ
MA;2105302;IMPERATRIZ;10258;F00839;UPR DE IMPERATRIZ
MA;2105302;IMPERATRIZ;10257;F02543;APAC DE IMPERATRIZ
MA;2105401;ITAPECURU MIRIM;10272;F02195;UPR DE ITAPECURU MIRIM
MA;2105401;ITAPECURU MIRIM;10273;F02544;APAC DE ITAPECURUMIRIM
MA;2107506;PACO DO LUMIAR;10282;F02537;APAC DE SAO LUIS
MA;2107506;PACO DO LUMIAR;10283;F02550;CENTRO SOCIOEDUCATIVO DE INTERNAÇÃO  SITIO NOVA VIDA
MA;2108207;PEDREIRAS;10275;F02198;APAC PEDREIRAS
MA;2108207;PEDREIRAS;10276;F00037;PENITENCIÁRIA REGIONAL DE PEDREIRAS
MA;2108603;PINHEIRO;10277;F02541;PENITENCIARIA REGIONAL DE PINHEIRO
MA;2108603;PINHEIRO;10278;F03372;UNIDADE PRISIONAL DE RESSOCIALIZAÇÃO DE PINHEIRO
MA;2109007;PORTO FRANCO;10260;F02323;UPR DE PORTO DE FRANCO
MA;2109106;PRESIDENTE DUTRA;10274;F02500;UPR DE PRESIDENTE DUTRA
MA;2109601;ROSARIO;10284;F01626;UNIDADE PRISIONAL DE RESSOCIALIZAÇÃO DO ROSÁRIO
MA;2109908;SANTA INES;10279;F00601;UPR DE SANTA INÊS
MA;2111102;SAO JOAO DOS PATOS;10280;F03045;UNIDADE PRISIONAL DE SÃO JOÃO DOS PATOS
MA;2111300;SAO LUIS;10298;F01881;UPR SÃO LUÍS 2
MA;2111300;SAO LUIS;10296;F01396;UPR SÃO LUIS 4
MA;2111300;SAO LUIS;10301;F06963;UPSL 7 SÃO LUIS 7
MA;2111300;SAO LUIS;10297;F01623;UPR SÃO LUÍS 1
MA;2111300;SAO LUIS;10295;F00841;UPR SÃO LUÍS 6
MA;2111300;SAO LUIS;10290;F00840;UPR DO ANIL
MA;2111300;SAO LUIS;10291;F00599;UNIDADE PRISIONAL DE RESSOCIALIZAÇÃO DO OLHO DAGUA
MA;2111300;SAO LUIS;10294;F00598;UPR  FEMININA
MA;2111300;SAO LUIS;10292;F00651;CENTRO DA JUVENTUDE CANAÃ
MA;2111300;SAO LUIS;10293;F00038;PENITENCIÁRIA REGIONAL DE SÃO LUÍS
MA;2111300;SAO LUIS;10287;F01943;CENTRO SOCIOEDUCATIVO DE INTERNAÇÃO SÃO JOSÉ DE RIBAMAR
MA;2111300;SAO LUIS;10286;F00365;CENTRO DA JUVENTUDE FLORESCER
MA;2111300;SAO LUIS;10302;F02532;UPR DE ZÉ DOCA
MA;2111300;SAO LUIS;10285;F01140;UNIDADE PRISIONAL DE RESSOCIALIZAÇÃO MONTE CASTELO
MA;2111300;SAO LUIS;10288;F01139;UPR DE SÃO LUÍS 3
MA;2111300;SAO LUIS;10299;F02533;UPR SÃO LUIS 5
MA;2111300;SAO LUIS;10300;F03662;UNIDADE PRISIONAL DE RESSOCIALIZAÇÃO DE SEGURANÇA MAXIMA
MA;2111300;SAO LUIS;10289;F03507;CENTRO SOCIOEDUCATIVO DE INTERNAÇÃO SÃO CRISTÓVÃO
MA;2112209;TIMON;10307;F02229;APAC TIMON
MA;2112209;TIMON;10308;F01395;UPR DE TIMON
MA;2112209;TIMON;10309;F03088;PENITENCIÁRIA REGIONAL DE TIMON
MA;2112506;TUTOIA;10303;F03386;UNIDADE PRISIONAL DE TUTÓIA
MA;2112803;VIANA;10305;F02538;UPR DE VIANA
MA;2112803;VIANA;10306;F05145;APAC ESTADUAL FEMININA DE VIANA
MA;2112803;VIANA;10304;F02534;APAC DE VIANA
MG;3100203;ABAETE;10351;F01772;PRESIDIO DE ABAETE
MG;3101508;ALEM PARAIBA;10464;F04861;PRESIDIO DE ALEM PARABA I
MG;3101607;ALFENAS;10499;F02032;APAC DE ALFENAS
MG;3101607;ALFENAS;10500;F01767;PRESIDIO DE ALFENAS
MG;3128303;ALFENAS;10500;F01767;PRESIDIO DE ALFENAS
MG;3101706;ALMENARA;10417;F01025;PRESIDIO DE ALMENARA
MG;3128303;ANDRADAS;10363;F00177;PRESIDIO DE ANDRADAS
MG;3102605;ANDRADAS;10363;F00177;PRESIDIO DE ANDRADAS
MG;3103405;ARACUAI;10418;F05146;PRESIDIO DE ARAÇUAI I
MG;3103504;ARAGUARI;10459;F02028;PRESIDIO DE ARAGUARI
MG;3104007;ARAXA;10480;F01526;PRESÍDIO DE ARAXÁ
MG;3104007;ARAXA;10481;F02244;APAC DE ARAXA
MG;3104205;ARCOS;10320;F00441;APAC ARCOS
MG;3105400;BARAO DE COCAIS;10323;F02033;PRESIDIO DE BARAO DE COCAIS
MG;3105400;BARAO DE COCAIS;10324;F05124;APAC ITABIRA I
MG;3105608;BARBACENA;10384;F00176;HOSPITAL PSIQUIATRICO E JUDICIARIO JORGE VAZ
MG;3105608;BARBACENA;10383;F01529;PRESIDIO DE BARBACENA
MG;3106200;BELO HORIZONTE;10374;F00528;CENTRO  SOCIOEDUCATIVO SÃO JERÔNIMO  CSESJ
MG;3106200;BELO HORIZONTE;10379;F02505;PRESIDIO DE TRÊS MARIAS
MG;3106200;BELO HORIZONTE;10376;F01276;PRESIDIO DE INHAPIM
MG;3106200;BELO HORIZONTE;10378;F01573;CENTRO SOCIOEDUCATIVO SANTA CLARA
MG;3106200;BELO HORIZONTE;10373;F02024;PENITENCIÁRIA DE BELO HORIZONTE I
MG;3106200;BELO HORIZONTE;10370;F04396;APAC FEMININA DE BELO HORIZONTE I
MG;3106200;BELO HORIZONTE;10372;F02060;CENTRO SOCIOEDUCATIVO ANDRADAS   CSEA
MG;3106200;BELO HORIZONTE;10377;F02415;PRESÍDIO DE NOVO CRUZEIRO
MG;3106200;BELO HORIZONTE;10375;F01753;CASA DO ALBERGADO DE BELO HORIZONTE I
MG;3106200;BELO HORIZONTE;10371;F00778;CENTRO SOCIOEDUCATIVO SANTA HELENA
MG;3106705;BETIM;10424;F07301;APAC BETIM I
MG;3107109;BOA ESPERANCA;10362;F01028;PRESIDIO DE BOA ESPERANÇA I
MG;3107307;BOCAIUVA;10473;F02464;PRESIDIO DE BOCAIUVA
MG;3108404;BOTELHOS;10339;F02404;PRESIDIO DE BOTELHOS
MG;3109303;BURITIS;10333;F02466;PRESIDIO DE BURITIS
MG;3111200;CAMPO BELO;10501;F00703;APAC CAMPO BELO
MG;3111200;CAMPO BELO;10502;F01029;PRESIDIO DE CAMPO BELO
MG;3111606;CAMPOS GERAIS;10338;F01012;PRESIDIO DE CAMPOS GERAIS I
MG;3111804;CANAPOLIS;10497;F02405;PRESIDIO DE CANAPOLIS
MG;3113404;CARATINGA;10438;F00701;APAC CARATINGA
MG;3113404;CARATINGA;10439;F01286;PRESIDIO DE CARATINGA
MG;3113701;CARLOS CHAGAS;10330;F02492;PRESIDIO DE CARLOS CHAGAS
MG;3114303;CARMO DO PARANAIBA;10345;F00181;COMPLEXO PENITENCIARIO NOSSA SENHORA DO CARMO
MG;3115300;CATAGUASES;10343;F01520;PRESIDIO DE CATAGUASES
MG;3117306;CONCEICAO DAS ALAGOAS;10487;F05265;APAC CONCEIÇÃO DAS ALAGOAS I
MG;3118007;CONGONHAS;10366;F02494;PRESIDIO DE CONGONHAS
MG;3118304;CONSELHEIRO LAFAIETE;10386;F00739;PRESIDIO DE CONSELHEIRO LAFAIETE
MG;3118304;CONSELHEIRO LAFAIETE;10388;F03385;ASSOCIAÇÃO DE PROTEÇÃO E ASSISTÊNCIA AOS CONDENADOS  APAC FEMININA DE CONSELHEIRO LAFAIETE
MG;3118304;CONSELHEIRO LAFAIETE;10387;F01499;APAC MASCULINA DE CONSELHEIRO LAFAIETE I
MG;3118403;CONSELHEIRO PENA;10355;F00717;PRESIDIO DE CONSELHEIRO PENA
MG;3118601;CONTAGEM;10436;F00180;COMPLEXO PENITENCIARIO NELSON HUNGRIA
MG;3119104;CORINTO;10460;F02406;PRESIDIO DE  CORINTO
MG;3119302;COROMANDEL;10496;F01761;PRESIDIO DE COROMANDEL I SARGENTO JORGE
MG;3119401;CORONEL FABRICIANO;10456;F02019;PRESIDIO DE CORONEL FABRICIANO
MG;3120904;CURVELO;10440;F00179;PRESIDIO DE CURVELO
MG;3121605;DIAMANTINA;10420;F00492;PRESIDIO DE DIAMANTINA
MG;3122306;DIVINOPOLIS;10442;F02062;CENTRO SOCIOEDUCATIVO DIVINÓPOLIS  CSEDV
MG;3122306;DIVINOPOLIS;10441;F04610;PRESÍDIO DE DIVINÓPOLIS I
MG;3124005;ERVALIA;10357;F01784;PRESIDIO DE ERVÁLIA
MG;3124906;EUGENOPOLIS;10311;F01254;PRESIDIO DE EUGENOPOLIS I
MG;3126109;FORMIGA;10312;F01523;PENITENCIARIA DE FORMIGA I
MG;3126703;FRANCISCO SA;10354;F01766;PENITENCIARIA DE FRANCISCO SA
MG;3127107;FRUTAL;10482;F04362;APAC  JUVENIL DE FRUTAL MG  ASSOCIAÇÃO DE PROTEÇÃO E ASSISTÊNCIA AO CONDENADO
MG;3127107;FRUTAL;10483;F00469;PRESIDIO DE FRUTAL
MG;3127107;FRUTAL;10484;F01739;APAC DE FRUTAL
MG;3127701;GOVERNADOR VALADARES;10455;F01500;APAC DE GOVERNADOR DE VALADARES
MG;3127701;GOVERNADOR VALADARES;10453;F01024;PENITENCIARIA FRANCISCO FLORIANO DE PAULA
MG;3127701;GOVERNADOR VALADARES;10454;F00228;CENTRO SOCIOEDUCATIVO GOVERNADOR VALADARES  CSEGV
MG;3128006;GUANHAES;10421;F01497;PRESIDIO DE GUANHÃES
